conference_year,display_session_id,title,date_label,start_time,end_time,location,tracks,speakers,speaker_affiliations,detail_href
2026,,Preconference Workshop Registration,"Wednesday, April 29",6:30 am,9:00 am,,REGISTRATION | WORKSHOPS | ADD-ON EVENT,,,
2026,,Consortia Registration,"Wednesday, April 29",6:30 am,9:00 am,,REGISTRATION | CONSORTIA | ADD-ON EVENT,,,
2026,,Morning Preconference Workshops,"Wednesday, April 29",8:00 am,12:00 pm,,WORKSHOPS | ADD-ON EVENT,,,
2026,,General Conference Registration,"Wednesday, April 29",9:00 am,8:00 pm,,REGISTRATION,,,
2026,,Consortia,"Wednesday, April 29",9:00 am,5:00 pm,,CONSORTIA | ADD-ON EVENT,,,
2026,,Networking for Introverts,"Wednesday, April 29",12:00 pm,7:00 pm,Pre-Function Foyer,EVENTS & RECEPTIONS,,,/embedded/session/txIFuC91zxfXmk1Kefw1Z-3npWvIIX%40kh469Fy-hO5k%3D/5289469/?widget=primary
2026,,Afternoon Preconference Workshops,"Wednesday, April 29",1:00 pm,5:00 pm,,WORKSHOPS | ADD-ON EVENT,,,
2026,,Research Community Forums,"Wednesday, April 29",1:00 pm,5:30 pm,,RESEARCH COMMUNITY FORUMS | ADD-ON EVENT,,,
2026,,Diversity Inclusion Tour,"Wednesday, April 29",4:00 pm,5:00 pm,Registration Desk,EVENTS & RECEPTIONS,,,/embedded/session/txIFuC91zxfXmk1Kefw1Z-3npWvIIX%40kh469Fy-hO5k%3D/5146837/?widget=primary
2026,,Newcomer Reception,"Wednesday, April 29",5:30 pm,6:30 pm,R6,EVENTS & RECEPTIONS,,,/embedded/session/txIFuC91zxfXmk1Kefw1Z-3npWvIIX%40kh469Fy-hO5k%3D/5241557/?widget=primary
2026,,Opening Plenary,"Wednesday, April 29",7:00 pm,8:00 pm,Great Hall,EVENTS & RECEPTIONS,,,/embedded/session/txIFuC91zxfXmk1Kefw1Z-3npWvIIX%40kh469Fy-hO5k%3D/5146759/?widget=primary
2026,,Welcome Reception and Top Poster Display,"Wednesday, April 29",8:00 pm,9:30 pm,,EVENTS & RECEPTIONS | POSTER,,,
2026,,Continental Breakfast,"Thursday, April 30",7:00 am,8:00 am,Pre-Function Foyer,"BREAKFAST, LUNCH & BREAKS",,,
2026,,Fellows Breakfast (By Invitation Only),"Thursday, April 30",7:00 am,8:00 am,Great Hall B,"EVENTS & RECEPTIONS | BREAKFAST, LUNCH & BREAKS | BY INVITATION ONLY",Mindy Shoss,", University of Central Florida",/embedded/session/txIFuC91zxfXmk1Kefw1Z-3npWvIIX%40kh469Fy-hO5k%3D/5146825/?widget=primary
2026,,General Conference Registration,"Thursday, April 30",7:00 am,5:00 pm,,REGISTRATION,,,
2026,949,Seeing and Being Seen: Expanding Award Access for Women and Racial Minorities (Session ID 949),"Thursday, April 30",8:00 am,8:50 am,202,"DIVERSITY, EQUITY, INCLUSION, AND ACCESSIBILITY","Ny Mia Tran | Angela Grotto | Julie Olson-Buchanan | Kisha Jones | Mateo Cruz, Ph.D. (he/him)",", Salem State University | , Montclair State University | , California State University, Fresno | , Florida International University - College of Business | , Bentley University",/embedded/session/txIFuC91zxfXmk1Kefw1Z-3npWvIIX%40kh469Fy-hO5k%3D/5145657/?widget=primary
2026,891,Scientist–Practitioner Perspectives on Impactful Org Belonging Research (Session ID 891),"Thursday, April 30",8:00 am,8:50 am,206,ORGANIZATIONAL PROCESSES/DEVELOPMENT/CULTURE,Robert Bullock | Elizabeth Conjar | Laura Brooks Dueland | Natalie Perez | Salvatore Leone,", T-Mobile | , Amazon | , Inclusion Analytics, LLC",/embedded/session/txIFuC91zxfXmk1Kefw1Z-3npWvIIX%40kh469Fy-hO5k%3D/5145658/?widget=primary
2026,1271,Moving Beyond Benchmarks: The Role of I-O Psychology Expertise in Total Rewards (Session ID 1271),"Thursday, April 30",8:00 am,8:50 am,207,ORGANIZATIONAL PROCESSES/DEVELOPMENT/CULTURE,George Montgomery | Alec Munc | Nathan Bjornberg | Timothy Willis | Taylor Scotese,", Willis Towers Watson | , Eli Lilly | , Meta | , Humana | , WTW",/embedded/session/txIFuC91zxfXmk1Kefw1Z-3npWvIIX%40kh469Fy-hO5k%3D/5145659/?widget=primary
2026,1087,“The Past Is Prologue:” Studying Old Leadership Lessons Using New Behavioral Methods (Session ID 1087),"Thursday, April 30",8:00 am,8:50 am,214,LEADERSHIP/LEADER DEVELOPMENT,Marcus Dickson | Andrew Loignon | Nissa Gongora | Richard Guzzo,", Wayne State University | , Center for Creative Leadership | , Workforce Sciences Institute",/embedded/session/txIFuC91zxfXmk1Kefw1Z-3npWvIIX%40kh469Fy-hO5k%3D/5145660/?widget=primary
2026,577,Blending Kirkpatrick and Psychometrics to Evaluate Leadership Development Impact (Session ID 577),"Thursday, April 30",8:00 am,8:50 am,217,LEADERSHIP/LEADER DEVELOPMENT,Stewart Desson,", Lumina Learning",/embedded/session/txIFuC91zxfXmk1Kefw1Z-3npWvIIX%40kh469Fy-hO5k%3D/5145661/?widget=primary
2026,649,Future-Proofing Selection Tools for Diverse Minds and Emerging AI (Session ID 649),"Thursday, April 30",8:00 am,8:50 am,223,SELECTION/ASSESSMENT/INDIVIDUAL DIFFERENCES,Ana Garcia | Viena Cao,", Cappfinity",/embedded/session/txIFuC91zxfXmk1Kefw1Z-3npWvIIX%40kh469Fy-hO5k%3D/5145662/?widget=primary
2026,1432,Community of Interest: Bricolage in I-O: How to Do More With Less in a Changing World (Session ID 1432),"Thursday, April 30",8:00 am,8:50 am,228,ORGANIZATIONAL PROCESSES/DEVELOPMENT/CULTURE | SPECIAL SESSION,Jonathan Kochert | Matthew Christensen | Roza Jankovic | Kyle Benbow,", U.S. Army Research Institute for Behavioral and Social Sciences | , Deloitte Consulting | , Culture Amp | , Army Research Institute",/embedded/session/txIFuC91zxfXmk1Kefw1Z-3npWvIIX%40kh469Fy-hO5k%3D/5145663/?widget=primary
2026,,Rethinking Generational Differences in the Age of AI (Session ID1086),"Thursday, April 30",8:00 am,8:50 am,203/204,"DIVERSITY, EQUITY, INCLUSION, AND ACCESSIBILITY",Cody Cox | Brian Ruggeberg | David Costanza | Haleema Sadia | Joel Nadler,", St. Mary's University | , Spencer Stuart | , University of Virginia | , Northwell Health | , AOA Consultants and University of Indiana",/embedded/session/txIFuC91zxfXmk1Kefw1Z-3npWvIIX%40kh469Fy-hO5k%3D/5145664/?widget=primary
2026,1465,The 2026 SIOP Machine Learning Competition (Session Id 1465),"Thursday, April 30",8:00 am,8:50 am,208/209/210,TECHNOLOGY/ARTIFICIAL INTELLIGENCE | SPECIAL SESSION,Yizhen Egyn Zhu | Ivan Hernandez | Isaac Thompson,", Amazon | , Virginia Tech",/embedded/session/txIFuC91zxfXmk1Kefw1Z-3npWvIIX%40kh469Fy-hO5k%3D/5145665/?widget=primary
2026,,"Skills, Career and Leadership Development: Perspectives and Approaches (Session ID1014)","Thursday, April 30",8:00 am,8:50 am,211/212/213,LEADERSHIP/LEADER DEVELOPMENT,"Lauren Jeffery-Smith | Tiffany Shortridge, Ph.D. | Heather Ureksoy | Tyler Lewis",", Saville Assessment | , WTW | , Verizon | , Northside Hospital",/embedded/session/txIFuC91zxfXmk1Kefw1Z-3npWvIIX%40kh469Fy-hO5k%3D/5145666/?widget=primary
2026,,"Creative Micropractices: Cultivating Reflection, Connection, and Workplace Well-Being (Session ID1069)","Thursday, April 30",8:00 am,8:50 am,215/216,"MOTIVATION, ATTITUDES, AND EMOTIONS",Patricia Friberg,", Patricia Friberg Coaching",/embedded/session/txIFuC91zxfXmk1Kefw1Z-3npWvIIX%40kh469Fy-hO5k%3D/5145667/?widget=primary
2026,688,On the Spectrum All My (Work) Life: Autistic Experiences Before and After Hire (Session ID 688),"Thursday, April 30",8:00 am,8:50 am,218/219,"DIVERSITY, EQUITY, INCLUSION, AND ACCESSIBILITY | CONTENT AREA THEME TRACK",Cassidy Gaddie | Hudson Barthes | Mark Burnard | Jeffrey Olenick | Maira Ezerins | Sara Gutierrez | Tim Vogus,", American Psychological Association | , University of Georgia | , Marriott International | , The University of Georgia | , University of Central Florida | , SHL | , Vanderbilt University Owen Graduate School of Management",/embedded/session/txIFuC91zxfXmk1Kefw1Z-3npWvIIX%40kh469Fy-hO5k%3D/5145668/?widget=primary
2026,1057,The New Psychological Contract: From Loyalty to Learnability (Session ID 1057),"Thursday, April 30",8:00 am,8:50 am,220/221/222,ORGANIZATIONAL PROCESSES/DEVELOPMENT/CULTURE | CONTENT AREA THEME TRACK,Jennifer Cullen | Kristen Williamson | Talya Bauer | Jordan Hartley | Caroline Deck,", Visa | , Spencer Stuart | , Portland State University | , Everpure | , Dell Technologies",/embedded/session/txIFuC91zxfXmk1Kefw1Z-3npWvIIX%40kh469Fy-hO5k%3D/5145669/?widget=primary
2026,,Setting a Cut Score Without Bleeding: Methods for Practitioners (Session ID1073),"Thursday, April 30",8:00 am,8:50 am,225/226,SELECTION/ASSESSMENT/INDIVIDUAL DIFFERENCES,Allie Wehling | Ashlie Plants | Kama Dodge | Morgan Tillery | Alexander Stemer,", Cisco | , Merck | , HackerRank | , AT&T | , Amazon",/embedded/session/txIFuC91zxfXmk1Kefw1Z-3npWvIIX%40kh469Fy-hO5k%3D/5145670/?widget=primary
2026,1227,Where Did All of the SIOP Training Sessions Go? Is T and D Still Important? (Session ID 1227),"Thursday, April 30",8:00 am,8:50 am,B2-1,TRAINING/COACHING/MENTORING | CONTENT AREA THEME TRACK,"Jason Randall | Ricardo Brooks | George Alliger | Amanda Woods Herron | Margaret Beier | Dr. Jay H. Hardy, III | Traci Sitzmann",", Portland State University | , The Pennsylvania State University | , Consulting Work Psychologist | , The University of Texas MD Anderson Cancer Center | , Rice University | , Oregon State University | , University of Colorado Denver",/embedded/session/txIFuC91zxfXmk1Kefw1Z-3npWvIIX%40kh469Fy-hO5k%3D/5145671/?widget=primary
2026,259,Who’s Accountable in the Age of AI? Redefining Accountability and Leadership Identity (Session ID 259),"Thursday, April 30",8:00 am,8:50 am,B2-2,TECHNOLOGY/ARTIFICIAL INTELLIGENCE | CONTENT AREA THEME TRACK,Laura Pineault | Cintya Garcia Marquez | Katherine Gibbard | Rebecca Stern | Kyle Sandell,", McKinsey & Company | , Microsoft Viva | , SAP SuccessFactors | , Forward Progress | , BetterUp",/embedded/session/txIFuC91zxfXmk1Kefw1Z-3npWvIIX%40kh469Fy-hO5k%3D/5145672/?widget=primary
2026,,Leadership/Leader Development Posters,"Thursday, April 30",8:00 am,8:50 am,Exhibit Hall,POSTER | LEADERSHIP/LEADER DEVELOPMENT,,,
2026,578,Training AI Skills in the Classroom: Embedding AI Skills in Graduate I-O Training (Session ID 578),"Thursday, April 30",8:00 am,8:50 am,R1,I-O PSYCHOLOGIST CAREER DEVELOPMENT/TEACHING,Pete Mclemore | Anna Godollei | Lacie Barber | Logan Watts | Mark Frame | Philseok Lee,", The University of Texas at Arlington | , Baruch College & The Graduate Center, City University of New York | , San Diego State University | , University of Texas at Arlington | , Middle Tennessee State University | , George Mason University",/embedded/session/txIFuC91zxfXmk1Kefw1Z-3npWvIIX%40kh469Fy-hO5k%3D/5145699/?widget=primary
2026,1316,Human-Centered Personas at Scale: Using LLMs and RAG to Build Personas Using Mixed Me (Session ID 1316),"Thursday, April 30",8:00 am,8:50 am,R2,RESEARCH METHODS/MEASUREMENT/STATISTICS,Alice Choe | Diana Wolfe | Chelsea Homann,", University of Toronto | Avanade | , Kyndryl | , Open to Work",/embedded/session/txIFuC91zxfXmk1Kefw1Z-3npWvIIX%40kh469Fy-hO5k%3D/5145700/?widget=primary
2026,539,"Pay Equity in Trump 2.0: Enforcement, Litigation, and Organizational Response (Session ID 539)","Thursday, April 30",8:00 am,8:50 am,R3,LEGAL/ETHICAL/CURRENT EVENTS/HUMANITARIAN/PRO-SOCIAL,Lisa Harpe | Quenton Wright | Scott Kelly,", DCI Consulting Group, Inc. | , Charles River Associates | , Ogletree",/embedded/session/txIFuC91zxfXmk1Kefw1Z-3npWvIIX%40kh469Fy-hO5k%3D/5145701/?widget=primary
2026,1313,Selling I-O Without Selling Out: A Vital Skill for All Practitioners (Session ID 1313),"Thursday, April 30",8:00 am,8:50 am,R4,I-O PSYCHOLOGIST CAREER DEVELOPMENT/TEACHING,Dr. William Shepherd | Dr. Emilee B. Tison | Justin Hess | Kim Macdonald | Ryan O'Leary | Ben Porr,", Elevation Leadership, LLC | , Meta | , Capital One | , Tru-Stamp (in Stealth Mode) | , PDRI | , Harver",/embedded/session/txIFuC91zxfXmk1Kefw1Z-3npWvIIX%40kh469Fy-hO5k%3D/5145702/?widget=primary
2026,,Interdisciplinary Collaboration Guided by a Case Study and Applied Exercise (Session ID1034),"Thursday, April 30",8:00 am,8:50 am,R5,I-O PSYCHOLOGIST CAREER DEVELOPMENT/TEACHING,Cristina Banks | Haley Cobb | Rebecca Brossoit | Ryszard Koziel,", University of California, Berkeley | , Louisiana State University | , Rice University | , Saint Louis University School of Medicine",/embedded/session/txIFuC91zxfXmk1Kefw1Z-3npWvIIX%40kh469Fy-hO5k%3D/5145703/?widget=primary
2026,989,Decoding AI: Amplifier of Belonging or Architect of Inequity? (Session ID 989),"Thursday, April 30",8:00 am,8:50 am,R6,TECHNOLOGY/ARTIFICIAL INTELLIGENCE,C. Malik Boykin | Christine Smith | Stephanie Tavarez | Taiwo Togun,", Brown University | , The Culture Backbeat | , University of Hartford | , SeqHub AI Academy",/embedded/session/txIFuC91zxfXmk1Kefw1Z-3npWvIIX%40kh469Fy-hO5k%3D/5145704/?widget=primary
2026,1444,SIOP Executive Board: SIOP and the Shifting Higher Edu Landscape: How Should the Profession Navigate? (Session ID 1444),"Thursday, April 30",8:00 am,8:50 am,R7,TRAINING/COACHING/MENTORING | SPECIAL SESSION,Dr. Christopher Wiese | Christopher Cunningham | Sophie Kay | Clair Reynolds Kueny | Richard Landers | Stephanie Payne,", Georgia Institute of Technology | , University of Tennessee at Chattanooga / Logi-Serve | , Meta | , Missouri University of Science and Technology | , Society for Industrial and Organizational Psychology (APA Div #14) | , Texas A&M University",/embedded/session/txIFuC91zxfXmk1Kefw1Z-3npWvIIX%40kh469Fy-hO5k%3D/5145705/?widget=primary
2026,199,"AI-Assisted Applications: Rethinking How We Apply, Hire, and Connect (Session ID 199)","Thursday, April 30",8:00 am,8:50 am,R8,TECHNOLOGY/ARTIFICIAL INTELLIGENCE,Kimberly Silva | April Cantwell Holland | Cat Yaris | Lauren Wegmeyer | Ngoc Duong,", Talogy | , Harver | , Capital One | , PepsiCo",/embedded/session/txIFuC91zxfXmk1Kefw1Z-3npWvIIX%40kh469Fy-hO5k%3D/5145706/?widget=primary
2026,589,Generative AI Adoption: Competency Framework and Organizational Applications (Session ID 589),"Thursday, April 30",8:00 am,8:50 am,R9,TECHNOLOGY/ARTIFICIAL INTELLIGENCE,Kate Bravery,", Mercer, A Marsh Business",/embedded/session/txIFuC91zxfXmk1Kefw1Z-3npWvIIX%40kh469Fy-hO5k%3D/5145707/?widget=primary
2026,151,Where Can Bots Take Us Next? Novel Applications of Generative AI in Item Generation (Session ID 151),"Thursday, April 30",8:00 am,8:50 am,229,TECHNOLOGY/ARTIFICIAL INTELLIGENCE,Nicholas Baldwin | Ben Hawkes | Averie Linnell | Seren Ozkum,", DCS Corporation | , The Hiring Science Studio | , University of Nebraska at Omaha | , Illinois State University",/embedded/session/txIFuC91zxfXmk1Kefw1Z-3npWvIIX%40kh469Fy-hO5k%3D/5146387/?widget=primary
2026,771,Women of I-O From Newbie to OG: Perspectives and Advice From the Field (Session ID 771),"Thursday, April 30",9:00 am,10:20 am,202,"DIVERSITY, EQUITY, INCLUSION, AND ACCESSIBILITY",Dawn Lambert | Penelope Palmer | Enrica Ruggs | Hannah Asbury | Leaetta Hough | Nancy Tippins | Ann Marie Ryan,", Talogy | , University of Houston | , Dunnette Group | , The Nancy T. Tippins Group, LLC | , Michigan State University",/embedded/session/txIFuC91zxfXmk1Kefw1Z-3npWvIIX%40kh469Fy-hO5k%3D/5145708/?widget=primary
2026,261,"More, Better, Now: Winning With Talent (Session ID 261)","Thursday, April 30",9:00 am,10:20 am,206,ORGANIZATIONAL PROCESSES/DEVELOPMENT/CULTURE,Angela Lane | D Crum | Sergey Gorbatov,", IE University | , AbbVie | , IE Business School",/embedded/session/txIFuC91zxfXmk1Kefw1Z-3npWvIIX%40kh469Fy-hO5k%3D/5145709/?widget=primary
2026,938,From Insight to Action: Driving Engagement and Retention Through Behavioral Science (Session ID 938),"Thursday, April 30",9:00 am,9:50 am,207,ORGANIZATIONAL PROCESSES/DEVELOPMENT/CULTURE,Ellen Lovell | Israa Khan | Pasquale Bisecco | Stephanie Schloemer,", Perceptyx, Inc. | , Onvida Health | , Sysco · Full-time | , Perceptyx",/embedded/session/txIFuC91zxfXmk1Kefw1Z-3npWvIIX%40kh469Fy-hO5k%3D/5145710/?widget=primary
2026,974,"It's Not Me, It's Us: A Relational Process Perspective to Leadership and Followership (Session ID 974)","Thursday, April 30",9:00 am,10:20 am,214,LEADERSHIP/LEADER DEVELOPMENT,Emily Forgo | John Kauth | Marcus Dickson | Jon Gruda | Virginia Choi,", University of Maryland, College Park | , Wayne State University | , U.S. Naval Academy",/embedded/session/txIFuC91zxfXmk1Kefw1Z-3npWvIIX%40kh469Fy-hO5k%3D/5145711/?widget=primary
2026,237,Beyond Utility: Advancing ROI in Talent Assessment Practices (Session ID 237),"Thursday, April 30",9:00 am,10:20 am,217,SELECTION/ASSESSMENT/INDIVIDUAL DIFFERENCES,Michael DeNunzio | Paul Agnello | Jesse Caylor | Justin Aqwa | Ken Yusko | Timothy Bartkoski | Yael Oelbaum,", Aon | , Procter & Gamble | , Stripe | , University of Maryland/College Park | , PepsiCo | , JetBlue",/embedded/session/txIFuC91zxfXmk1Kefw1Z-3npWvIIX%40kh469Fy-hO5k%3D/5145712/?widget=primary
2026,671,New Advances in Understanding Workplace Interests (Session ID 671),"Thursday, April 30",9:00 am,10:20 am,223,SELECTION/ASSESSMENT/INDIVIDUAL DIFFERENCES,Christopher Nye | Daphne Hou | Joshua Pearman | Lena Roemer | Yifan Zhang,", Michigan State University | , University of South Florida College of Arts and Sciences · Full-time | , Roblox",/embedded/session/txIFuC91zxfXmk1Kefw1Z-3npWvIIX%40kh469Fy-hO5k%3D/5145713/?widget=primary
2026,1457,Community of Interest: Building International Collaborations for Impact (Session ID 1457),"Thursday, April 30",9:00 am,9:50 am,228,LEGAL/ETHICAL/CURRENT EVENTS/HUMANITARIAN/PRO-SOCIAL | SPECIAL SESSION,"Juliette (Dr. Nelson) Nelson | Nicholas Smith | Donald Truxillo | Marilena Bertolino | Xaulanda Simmonds-Emmanuel, PhD",", JUNURI | , Kemmy Business School, University of Limerick | , Université Nice Côte d'Azur | , The XauSky Group, LLC",/embedded/session/txIFuC91zxfXmk1Kefw1Z-3npWvIIX%40kh469Fy-hO5k%3D/5145714/?widget=primary
2026,228,GenAI in Assessment II: Follow-Up on Applied Programmatic Research Findings (Session ID 228),"Thursday, April 30",9:00 am,10:20 am,229,SELECTION/ASSESSMENT/INDIVIDUAL DIFFERENCES,Jeffrey Facteau | Kristina Renee Barr | Michael Fetzer | Tracy Kantrowitz,", HackerRank | , Amazon · Full-time | , Aon | , PDRI Pearson",/embedded/session/txIFuC91zxfXmk1Kefw1Z-3npWvIIX%40kh469Fy-hO5k%3D/5145715/?widget=primary
2026,621,"Creating Neuroinclusive Workplaces: Data, Practice, and Organizational Change (Session ID 621)","Thursday, April 30",9:00 am,10:20 am,203/204,"DIVERSITY, EQUITY, INCLUSION, AND ACCESSIBILITY",William Camden | Dejannae Lang | Julia King | McKenzie Specht | Gordon Schmidt,", SHL | , Carter Development Group | , University of Louisiana Monroe",/embedded/session/txIFuC91zxfXmk1Kefw1Z-3npWvIIX%40kh469Fy-hO5k%3D/5145717/?widget=primary
2026,1043,I-Os in Academic Spaces: All the Places We Can Go (Session ID 1043),"Thursday, April 30",9:00 am,10:20 am,208/209/210,I-O PSYCHOLOGIST CAREER DEVELOPMENT/TEACHING,Elliott Larson | Jennifer Alamanteoff | Jenna McChesney | Jessica Thornton | Kevin Wynne | Victoria Lew | Kira Marshall | Nathan Price - The Academic IO | Dr. Richard A. Mendelson | Stephanie Turner | Steven J. Baines | Sydney Reichin | Marla J Albertie PhD,", Baruch College, the City University of New York | , The Ohio State University Wexner Medical Center | , Meredith College | , athenahealth | , University of Baltimore | , FSC | , University of Washington | , The Academic IO | , Keiser University | , Tuck School of Business, Dartmouth College | , Walden University | , North Carolina State University | , CTU",/embedded/session/txIFuC91zxfXmk1Kefw1Z-3npWvIIX%40kh469Fy-hO5k%3D/5145718/?widget=primary
2026,184,Stop Workplace Conflict at Its Source Using the Emotional Connection (EmC) Process (Session ID 184),"Thursday, April 30",9:00 am,10:20 am,211/212/213,LEADERSHIP/LEADER DEVELOPMENT,Lola Gershfeld,", EMC LEADERS",/embedded/session/txIFuC91zxfXmk1Kefw1Z-3npWvIIX%40kh469Fy-hO5k%3D/5145719/?widget=primary
2026,57,"You Are Not Alone: How Families, Peers, and Systems Drive Support for Work–Family (Session ID 57)","Thursday, April 30",9:00 am,10:20 am,215/216,OCCUPATIONAL HEALTH/WORK AND FAMILY,Zihan Liu | Wendy Casper | Molly Schoffel | Yingyi Chang,", Singapore Management University | , University of Texas at Arlington | , University of South Florida | , Wayne State University",/embedded/session/txIFuC91zxfXmk1Kefw1Z-3npWvIIX%40kh469Fy-hO5k%3D/5145720/?widget=primary
2026,278,Beyond the Diversity Wars: Paths Forward for DEI Research and Practice (Session ID 278),"Thursday, April 30",9:00 am,10:20 am,218/219,"DIVERSITY, EQUITY, INCLUSION, AND ACCESSIBILITY | CONTENT AREA THEME TRACK",Thomas Becker | Adrienne Colella | Elissa Perry | Glenn Newman | Michelle (Mikki) Hebl,", University of South Florida | , Tulane University | , Teachers College, Columbia University | , Lead With Empathy LLC | , Rice University",/embedded/session/txIFuC91zxfXmk1Kefw1Z-3npWvIIX%40kh469Fy-hO5k%3D/5145721/?widget=primary
2026,779,Succession Planning: Misery Loves Company and Stump the Experts! (Session ID 779),"Thursday, April 30",9:00 am,10:20 am,220/221/222,ORGANIZATIONAL PROCESSES/DEVELOPMENT/CULTURE | CONTENT AREA THEME TRACK,Brittany Marcus-Blank | Charlotte Powers | Courtney Paynter | Lilly Lin | Jane Rudolph (Vignovic) | Matthew Dreyer,", Johnson & Johnson | , GE Aerospace | , AbbVie | , Russell Reynolds Associates | , VF Corporation | , Prudential Financial",/embedded/session/txIFuC91zxfXmk1Kefw1Z-3npWvIIX%40kh469Fy-hO5k%3D/5145723/?widget=primary
2026,879,AI Meets Meta-Analysis: Accelerating Evidence for the Age of Exponential Knowledge (Session ID 879),"Thursday, April 30",9:00 am,10:20 am,225/226,RESEARCH METHODS/MEASUREMENT/STATISTICS,Zhaoli Song | Piers Steel,", NUS | , University of Calgary",/embedded/session/txIFuC91zxfXmk1Kefw1Z-3npWvIIX%40kh469Fy-hO5k%3D/5145724/?widget=primary
2026,1092,Coaching Bootcamp: Leveling Up Your Coaching With Assessments and Analytics (Session ID 1092),"Thursday, April 30",9:00 am,10:20 am,B2-1,TRAINING/COACHING/MENTORING | CONTENT AREA THEME TRACK,Catherine Savage | Dale Rose | Jake Weiss | Stefanie Mockler,", 3D Group | , Coachability Consultants, Inc. | , The Violet Group",/embedded/session/txIFuC91zxfXmk1Kefw1Z-3npWvIIX%40kh469Fy-hO5k%3D/5145725/?widget=primary
2026,1415,The Great AI Debate: Where AI Fits—and Where It Doesn’t (Session Id 1415),"Thursday, April 30",9:00 am,10:20 am,B2-2,TECHNOLOGY/ARTIFICIAL INTELLIGENCE | CONTENT AREA THEME TRACK,Allan Church,", Maestro Consulting LLC",/embedded/session/txIFuC91zxfXmk1Kefw1Z-3npWvIIX%40kh469Fy-hO5k%3D/5145726/?widget=primary
2026,,Selection/Assessment/Individual Differences Posters,"Thursday, April 30",9:00 am,9:50 am,Exhibit Hall,POSTER | SELECTION/ASSESSMENT/INDIVIDUAL DIFFERENCES,,,
2026,557,Daydreams of Better Research Methods Papers: What Editors Hope Authors Will Do (Session ID 557),"Thursday, April 30",9:00 am,10:20 am,R1,RESEARCH METHODS/MEASUREMENT/STATISTICS,Lisa Lambert | Dina Krasikova | Jeremy Dawson | Justin DeSimone | James LeBreton | Jose Cortina | Larry Williams | Michael Sturman | Paul Bliese,", Texas Christian University | , The University of Texas at San Antonio | , University of Sheffield | , University of Alabama | , Pennsylvania State University | , Virginia Commonwealth University | , Texas Tech University | , Rutgers University | , Darla Moore School of Business",/embedded/session/txIFuC91zxfXmk1Kefw1Z-3npWvIIX%40kh469Fy-hO5k%3D/5145768/?widget=primary
2026,60,Consequences of Generative AI for Graduate Education in I-O Psychology (Session ID 60),"Thursday, April 30",9:00 am,10:20 am,R2,TECHNOLOGY/ARTIFICIAL INTELLIGENCE,Joel Lefkowitz | Anna Godollei | Dr. Christopher Wiese | Deirdre Knapp | Manuel Gonzalez | John Capman | Logan Watts,", Baruch College and the Graduate Center, CUNY | , Baruch College & The Graduate Center, City University of New York | , Georgia Institute of Technology | , Retired | , Montclair State University | , Amazon | , University of Texas at Arlington",/embedded/session/txIFuC91zxfXmk1Kefw1Z-3npWvIIX%40kh469Fy-hO5k%3D/5145769/?widget=primary
2026,495,Job Design in the GenAI Era: Forecasting and Reshaping the Future of Work (Session ID 495),"Thursday, April 30",9:00 am,10:20 am,R3,TECHNOLOGY/ARTIFICIAL INTELLIGENCE,Ernie Paskey | Evan Theys | Josh Allen | Nita Prabhu,", Aon | , Palo Alto Networks | , Walmart | , Amazon",/embedded/session/txIFuC91zxfXmk1Kefw1Z-3npWvIIX%40kh469Fy-hO5k%3D/5145770/?widget=primary
2026,320,What Will Happen to All the Workers? An Interactive Future-Casting Session on Impact (Session ID 320),"Thursday, April 30",9:00 am,10:20 am,R4,TECHNOLOGY/ARTIFICIAL INTELLIGENCE,Brodie Riordan | Kate LaPort | Ketaki Sodhi | Dr. Neil Morelli | Ryan O'Leary | Taylor Sullivan,", Ocular, Georgetown University | , Amazon | , Microsoft | , Salesforce | , PDRI | , Workera",/embedded/session/txIFuC91zxfXmk1Kefw1Z-3npWvIIX%40kh469Fy-hO5k%3D/5145771/?widget=primary
2026,686,Finding Your Midcareer Edge: A Panel and Consortium Preview (Session ID 686),"Thursday, April 30",9:00 am,10:20 am,R5,I-O PSYCHOLOGIST CAREER DEVELOPMENT/TEACHING,Dr. Eric Surface | Jill May | Kristina Bauer | Lisa Finkelstein | Rachel Smith | Rachel Callan,", ALPS Insights | , City of Chicago | , Illinois Institute of Technology | , Northern Illinois University | , Georgia Southern University | , Adobe",/embedded/session/txIFuC91zxfXmk1Kefw1Z-3npWvIIX%40kh469Fy-hO5k%3D/5145772/?widget=primary
2026,98,From Insight to Impact: I-O Psychologists as Agents of Prosocial Change (Session ID 98),"Thursday, April 30",9:00 am,10:20 am,R6,LEGAL/ETHICAL/CURRENT EVENTS/HUMANITARIAN/PRO-SOCIAL,Thisali Mendis | Jason Randall | Julie Katharine Jasewicz | Samantha England | Sharon Chung,", George Mason University | , Portland State University | , Volunteer Program Assessment (VPA) | , FMP LLC | , University of Georgia",/embedded/session/txIFuC91zxfXmk1Kefw1Z-3npWvIIX%40kh469Fy-hO5k%3D/5145773/?widget=primary
2026,970,"AI-Driven Assessment Development: Automating Item Generation, Fairness, and Validation (Session Id 970)","Thursday, April 30",9:00 am,10:20 am,R7,TECHNOLOGY/ARTIFICIAL INTELLIGENCE,Philseok Lee | Tariq Shaban,", George Mason University | , Podium",/embedded/session/txIFuC91zxfXmk1Kefw1Z-3npWvIIX%40kh469Fy-hO5k%3D/5145774/?widget=primary
