conference_year,display_session_id,title,date_label,start_time,end_time,location,tracks,speakers,speaker_affiliations,detail_href
2026,,Groups/Teams; Legal/Ethical/Current Events/Humanitarian/Pro-Social; Global/International/Cross-Cultural Issues; Organizational Processes/Development/Culture Posters,"Saturday, May 2",8:00 am,8:50 am,Exhibit Hall,POSTER | GROUPS/TEAMS | LEGAL/ETHICAL/CURRENT EVENTS/HUMANITARIAN/PRO-SOCIAL | GLOBAL/INTERNATIONAL/CROSS-CULTURAL ISSUES | ORGANIZATIONAL PROCESSES/DEVELOPMENT/CULTURE,,,
2026,1228,Preparing Future I-O Psychology Professionals for Consulting: Bridging the Skills Gap (Session ID 1228),"Saturday, May 2",8:00 am,9:20 am,R1,I-O PSYCHOLOGIST CAREER DEVELOPMENT/TEACHING,Aishah Khan | Bre Timko | C. Allen Gorman | Jaclyn Menendez | Juliette Lloyd | Kevin Mitchell | Natalie Vanelli,", Clemson University | , DCI Consulting | , University of Alabama at Birmingham - Collat School of Business | , Hogan Assessments | , MIT Lincoln Laboratory | , Zillow Group",/embedded/session/txIFuC91zxfXmk1Kefw1Z-3npWvIIX%40kh469Fy-hO5k%3D/5146439/?widget=primary
2026,1420,"Into the Dark: Zombie Leadership, False Weapons, and You: Our Only Hope (Session ID 1420)","Saturday, May 2",8:00 am,9:20 am,R2,LEADERSHIP/LEADER DEVELOPMENT,Alex Haslam | Jackie Sahm | Jocelyn Hays | Robert Kaiser,", University of Queensland | , Hogan Assessments | , Kaiser Leadership Solutions",/embedded/session/txIFuC91zxfXmk1Kefw1Z-3npWvIIX%40kh469Fy-hO5k%3D/5146440/?widget=primary
2026,830,"No Experiment, No Problem? Causal Inference in Applied Quasi-Experimental Settings (Session ID 830)","Saturday, May 2",8:00 am,9:20 am,R3,RESEARCH METHODS/MEASUREMENT/STATISTICS,Ludek Stehlik | Marissa Post,", Sanofi",/embedded/session/txIFuC91zxfXmk1Kefw1Z-3npWvIIX%40kh469Fy-hO5k%3D/5146441/?widget=primary
2026,574,Approaches to Conducting Leadership Research in the Military (Session ID 574),"Saturday, May 2",8:00 am,9:20 am,R4,LEADERSHIP/LEADER DEVELOPMENT,Ann-Louise Holten | Benjamin Elliott | Ingrid Covington | Ivana Igic,", Forsvarsakademiet · Full-time | , University of Minnesota | , K U Leuven | , Military Academy ETH Zurich",/embedded/session/txIFuC91zxfXmk1Kefw1Z-3npWvIIX%40kh469Fy-hO5k%3D/5146442/?widget=primary
2026,1264,Building Assessment Center Stimuli With the Help of AI (Session ID 1264),"Saturday, May 2",8:00 am,9:20 am,R5,TECHNOLOGY/ARTIFICIAL INTELLIGENCE,Dr. Gregory J. Pool | Gabriel Reyes,", St. Mary's University | , St. Mary’s University",/embedded/session/txIFuC91zxfXmk1Kefw1Z-3npWvIIX%40kh469Fy-hO5k%3D/5146443/?widget=primary
2026,207,LLMs for I-Os 2.0: A Features and Applications Masterclass (Session ID 207),"Saturday, May 2",8:00 am,9:20 am,R6,TECHNOLOGY/ARTIFICIAL INTELLIGENCE,William Camden | Yizhen Egyn Zhu | Eva Riddervold Sandberg | Bao Ho | Karim Badr | Matthew Bennett,", SHL | , Amazon | , Aon | , McKinsey and Company",/embedded/session/txIFuC91zxfXmk1Kefw1Z-3npWvIIX%40kh469Fy-hO5k%3D/5146444/?widget=primary
2026,1310,"Striking the Balance: Trust, Integrity, and Expertise at the Human–AI Boundary in I-O (Session ID 1310)","Saturday, May 2",8:00 am,8:50 am,R7,TECHNOLOGY/ARTIFICIAL INTELLIGENCE,Michael Schwendeman | Caitlynn Sendra | Ken Lahti | Nicolette Rainone,", Heidrick & Struggles | , SAP SuccessFactors | , Humancore",/embedded/session/txIFuC91zxfXmk1Kefw1Z-3npWvIIX%40kh469Fy-hO5k%3D/5146445/?widget=primary
2026,384,This Is How We Do (Did) It: Integrating GenAI for Organizational Impact (Session ID 384),"Saturday, May 2",8:00 am,9:20 am,R8,TECHNOLOGY/ARTIFICIAL INTELLIGENCE,John Capman | Devin Stack | Evan Sinar | Reese Haydon | Krisrin Carbone | Renee Vieira | Salvatore Leone,", Amazon | , Takeda Pharmaceuticals | , PayPal | , T Rowe price | , Justworks · Full-time | , T-Mobile",/embedded/session/txIFuC91zxfXmk1Kefw1Z-3npWvIIX%40kh469Fy-hO5k%3D/5146446/?widget=primary
2026,848,Protecting Assessment Integrity in the AI Era: Cheating and Faking in Selection (Session ID 848),"Saturday, May 2",8:00 am,9:20 am,R9,TECHNOLOGY/ARTIFICIAL INTELLIGENCE,Chet Robie | Nataliya Baytalskaya | Damian Canagasuriam | Hilary Butera | Justin Feeney | Tariq Shaban,", Wilfrid Laurier University | , Talogy | , Saint Mary's College (Notre Dame, IN) | , Podium",/embedded/session/txIFuC91zxfXmk1Kefw1Z-3npWvIIX%40kh469Fy-hO5k%3D/5146447/?widget=primary
2026,920,Neurodivergence at Work: Practical Interventions for Career Success (Session ID 920),"Saturday, May 2",9:30 am,10:20 am,202,"DIVERSITY, EQUITY, INCLUSION, AND ACCESSIBILITY",Dustin Weilbach | Lida Ponce | Sarah Wittman | Adrienne Colella | Debra Comer | Susanne Bruyere,", George Mason University | , George Mason University - College of Humanities and Social Sciences · Full-time | , Tulane University | , Hofstra University | , Cornell University",/embedded/session/txIFuC91zxfXmk1Kefw1Z-3npWvIIX%40kh469Fy-hO5k%3D/5146448/?widget=primary
2026,300,Talent Strategy 360: Confronting Contradictions in the Future of Work (Session ID 300),"Saturday, May 2",9:30 am,10:20 am,206,ORGANIZATIONAL PROCESSES/DEVELOPMENT/CULTURE,Angela Lane | Gordon Rudow | Marc Effron | Martin Lanik | Kyle Sandell,", IE University | , Agency 150 | , The Talent Strategy Group | , Pinsight | , BetterUp",/embedded/session/txIFuC91zxfXmk1Kefw1Z-3npWvIIX%40kh469Fy-hO5k%3D/5146449/?widget=primary
2026,513,Stuck in the Middle With Skills: How I-Os Are Navigating the Skills-Based Talent Management Trend (Session ID 513),"Saturday, May 2",9:30 am,10:20 am,207,ORGANIZATIONAL PROCESSES/DEVELOPMENT/CULTURE,Ali Badibanga | Alexandra Bishop | Julia Brandon | Dr. Maureen E. McCusker | Melanie Standish | Nicole Sestrap,", Nike | , Lenovo | , Marriott International | , LinkedIn",/embedded/session/txIFuC91zxfXmk1Kefw1Z-3npWvIIX%40kh469Fy-hO5k%3D/5146450/?widget=primary
2026,1450,"SIOP Special Session: You Work From Home, So You’re Free… Right? (Session ID 1450)","Saturday, May 2",9:30 am,10:20 am,214,OCCUPATIONAL HEALTH/WORK AND FAMILY | SPECIAL SESSION,Afra Ahmad | Cindy Dziuba-Liu | Dominic Fedele | Hemang Vaidya | Dr. Meghan A. Thornton-Lugo | Xin Wei Ong,", George Mason University | , Spellman High Voltage Electronics Corporation | , Florida Institute of Technology | , The University of Akron | , University of Akron",/embedded/session/txIFuC91zxfXmk1Kefw1Z-3npWvIIX%40kh469Fy-hO5k%3D/5146451/?widget=primary
2026,1167,Game Face I-O Science: Personality and Cognitive Research on Elite Athletes (Session ID 1167),"Saturday, May 2",9:30 am,10:20 am,217,SELECTION/ASSESSMENT/INDIVIDUAL DIFFERENCES,"Nadine Maliakkal | Ryne Sherman | Harold Goldstein | Ken Yusko | Joseph W. Stewart, Ph.D.",", Hogan Assessment Systems | , Hogan Assessments | , The Graduate Center & Baruch College, CUNY | , University of Maryland/College Park | , University of Oklahoma",/embedded/session/txIFuC91zxfXmk1Kefw1Z-3npWvIIX%40kh469Fy-hO5k%3D/5146452/?widget=primary
2026,152,Application of AI in Psychological Assessment and Personnel Selection (Session ID 152),"Saturday, May 2",9:30 am,10:20 am,223,SELECTION/ASSESSMENT/INDIVIDUAL DIFFERENCES,Burning Li | Hanyi Min | Mengqiao (MQ) Liu | Kesea Nutter | Xinyi Li,", university of illinois at urbana champaign | , Amazon | , CMA Global | , Department of Psychological Studies at Rice University",/embedded/session/txIFuC91zxfXmk1Kefw1Z-3npWvIIX%40kh469Fy-hO5k%3D/5146453/?widget=primary
2026,1433,"Community of Interest: AI and Assessments, Lessons from the Field. What works, what doesn’t (Session ID 1433)","Saturday, May 2",9:30 am,10:20 am,228,SELECTION/ASSESSMENT/INDIVIDUAL DIFFERENCES | SPECIAL SESSION,Jonathan Kochert | Michelle Martin-Raugh | Shea Fyffe | Harrison Kell | Alicia Virthe,", U.S. Army Research Institute for Behavioral and Social Sciences | , The University of Texas at Arlington | , Army Research Institute | , The University Of Texas At Arlington",/embedded/session/txIFuC91zxfXmk1Kefw1Z-3npWvIIX%40kh469Fy-hO5k%3D/5146454/?widget=primary
2026,667,Looking for Space: Modernizing Visual-Spatial Ability for Personnel Assessment (Session ID 667),"Saturday, May 2",9:30 am,10:20 am,229,SELECTION/ASSESSMENT/INDIVIDUAL DIFFERENCES,Yicheng Xue | Joseph Coyne | Julia L. Walsh,", Baruch College and Graduate Center, CUNY | , Naval Research Laboratory | , DCS Corp",/embedded/session/txIFuC91zxfXmk1Kefw1Z-3npWvIIX%40kh469Fy-hO5k%3D/5146455/?widget=primary
2026,1352,The “Triple Bind”: Experiences of Neurodivergent Women of Color in the Workforce (Session ID 1352),"Saturday, May 2",9:30 am,10:20 am,203/204,"DIVERSITY, EQUITY, INCLUSION, AND ACCESSIBILITY",Juliette (Dr. Nelson) Nelson | Maria Elena De la Flor Musso,", JUNURI | , e Business Consultants, LLC",/embedded/session/txIFuC91zxfXmk1Kefw1Z-3npWvIIX%40kh469Fy-hO5k%3D/5146456/?widget=primary
2026,1066,"Designing Work for Humans: Inclusion, Fulfillment, and Fun (Session ID 1066)","Saturday, May 2",9:30 am,10:20 am,208/209/210,SELECTION/ASSESSMENT/INDIVIDUAL DIFFERENCES,Mavis Kung | Alanna Harrington | Irina Cozma,", Talogy | , Irina Cozma Consulting",/embedded/session/txIFuC91zxfXmk1Kefw1Z-3npWvIIX%40kh469Fy-hO5k%3D/5146457/?widget=primary
2026,712,From Solo to Squads: The Impact of Team Structure on Selection Work (Session ID 712),"Saturday, May 2",9:30 am,10:20 am,211/212/213,SELECTION/ASSESSMENT/INDIVIDUAL DIFFERENCES,Rick Hense | Andrew Solomonson | Michael Blair | Chad Parson | Morgan Tillery | Tracey Tafero,", Bank of America | , Delta Air Lines | , U.S. Office of Personnel Management | , Walmart | , AT&T | , Amazon",/embedded/session/txIFuC91zxfXmk1Kefw1Z-3npWvIIX%40kh469Fy-hO5k%3D/5146458/?widget=primary
2026,643,The Future of Work: Managing Technology and Employee Well-Being (Session ID 643),"Saturday, May 2",9:30 am,10:20 am,215/216,OCCUPATIONAL HEALTH/WORK AND FAMILY,Paige Watson | Michelle Nguyen | Lacie Barber | Adam Jacobs | Joseph Himmler | Kristi Lavigne | Tatiana Guevara,", Auburn University · Full-time | , Auburn University | , San Diego State University | , University of Central Florida",/embedded/session/txIFuC91zxfXmk1Kefw1Z-3npWvIIX%40kh469Fy-hO5k%3D/5146459/?widget=primary
2026,1298,The 2% Problem: Cultivating Sustainable High Performance Systems at Scale (Session ID 1298),"Saturday, May 2",9:30 am,10:20 am,218/219,JOB PERFORMANCE/WITHDRAWAL/MISBEHAVIOR | CONTENT AREA THEME TRACK,Kristen Williamson | Cat Yaris | Cathy Maraist | Laura Joiner,", Spencer Stuart | , Capital One | , Cencora | , Demandbase",/embedded/session/txIFuC91zxfXmk1Kefw1Z-3npWvIIX%40kh469Fy-hO5k%3D/5146460/?widget=primary
2026,745,It Takes Two: Provider and Recipient Perspectives on Workplace Helping (Session ID 745),"Saturday, May 2",9:30 am,10:20 am,220/221/222,"MOTIVATION, ATTITUDES, AND EMOTIONS | CONTENT AREA THEME TRACK",Chu-Hsiang (Daisy) Chang | Seoyeong Jeong | Joie Magalona | Nathan Baker,", Michigan State University | , Honeywell | , Wright State University",/embedded/session/txIFuC91zxfXmk1Kefw1Z-3npWvIIX%40kh469Fy-hO5k%3D/5146461/?widget=primary
2026,604,From Data to Decisions: Building Effective Talent Strategy Tools (Session ID 604),"Saturday, May 2",9:30 am,10:20 am,225/226,SELECTION/ASSESSMENT/INDIVIDUAL DIFFERENCES,Cari Gardner | Christa Bupp | Michelle Markow | Scott Hurst | Susannah Ivory,", HireVue | , Hogan Assessments | , Mix Talent | , Amazon | , Pennsylvania State University",/embedded/session/txIFuC91zxfXmk1Kefw1Z-3npWvIIX%40kh469Fy-hO5k%3D/5146462/?widget=primary
2026,114,Future of I-O: Training the Next Generation of I-Os in the Age of AI (Session ID 114),"Saturday, May 2",9:30 am,10:20 am,B2-1,I-O PSYCHOLOGIST CAREER DEVELOPMENT/TEACHING | CONTENT AREA THEME TRACK,Ally St. Aubin | Chiahao Hsu | Briana Squires | Rob Stilson | Seth Osborn | Tianjun Sun,", University of Houston | , Deloitte | , Lockheed Martin | , Rice University",/embedded/session/txIFuC91zxfXmk1Kefw1Z-3npWvIIX%40kh469Fy-hO5k%3D/5146463/?widget=primary
2026,805,End of Our Survey Era? Debating the Future of Employee Listening (Session ID 805),"Saturday, May 2",9:30 am,10:20 am,B2-2,RESEARCH METHODS/MEASUREMENT/STATISTICS | CONTENT AREA THEME TRACK,Danielle Wittorp | Kevin Rutherford | Meghan Lowery | Nicolette Rainone | Robert McMahon | Sami Nesnidol,", Owens Corning | , Welliba | , Korn Ferry | , Ford | , Atlassian · Full-time",/embedded/session/txIFuC91zxfXmk1Kefw1Z-3npWvIIX%40kh469Fy-hO5k%3D/5146464/?widget=primary
2026,,Technology/Artificial Intelligence Posters,"Saturday, May 2",9:30 am,10:20 am,Exhibit Hall,POSTER | TECHNOLOGY/ARTIFICIAL INTELLIGENCE,,,
2026,913,"People Analytics Careers: Past Promises, Present Realities, Future Possibilities (Session Id 913)","Saturday, May 2",9:30 am,10:20 am,R1,I-O PSYCHOLOGIST CAREER DEVELOPMENT/TEACHING,Rebecca Harmata | Sijia Li | Christina Fleck | Rhea Kapoor,", DDI | , PepsiCo | , The Cigna Group | , Wonder",/embedded/session/txIFuC91zxfXmk1Kefw1Z-3npWvIIX%40kh469Fy-hO5k%3D/5146506/?widget=primary
2026,1435,Alliance: Bringing Decent Work to the Next Generation of IWOP Professionals (Session ID 1435),"Saturday, May 2",9:30 am,10:20 am,R2,I-O PSYCHOLOGIST CAREER DEVELOPMENT/TEACHING | SPECIAL SESSION,Andrea Bazzoli | Mahima Saxena | Sharon Glazer | Vicente Martinez-Tur | Walter Reichman,", Baruch College | , University of Nebraska at Omaha | , Rutgers, The State University of NJ | , University of Valencia | , OrgVitality",/embedded/session/txIFuC91zxfXmk1Kefw1Z-3npWvIIX%40kh469Fy-hO5k%3D/5146507/?widget=primary
2026,748,"Entrepreneurship Through an I-O Lens: Resilience, Risk, and Leadership in Action (Session ID 748)","Saturday, May 2",9:30 am,10:20 am,R3,LEADERSHIP/LEADER DEVELOPMENT,Greg Haudek | Beau River | Paige Brown | Julie Moreland | Stefanie Mockler,", Hogan Assessments | , Leadership Delta Partners | , Morphii | , The Violet Group",/embedded/session/txIFuC91zxfXmk1Kefw1Z-3npWvIIX%40kh469Fy-hO5k%3D/5146508/?widget=primary
2026,344,Opportunities and Challenges in Large-Scale Leadership Assessment Programs (Session ID 344),"Saturday, May 2",9:30 am,10:20 am,R4,LEADERSHIP/LEADER DEVELOPMENT,"Jeffrey Ryer | Kendra Lyons, PhD | Alexandra Petruzzelli-Somers | Eric Brasher | Joshua Cotton | LeClaire Hammerle | Sharyn Aufenanger",", Aon | , Honeywell | , Eli Lilly and Company | , The Hershey Company",/embedded/session/txIFuC91zxfXmk1Kefw1Z-3npWvIIX%40kh469Fy-hO5k%3D/5146509/?widget=primary
2026,1307,One Thing After Another: Interdisciplinary Perspectives on Federal DEI Policies and Law (Session ID 1307),"Saturday, May 2",9:30 am,10:20 am,R5,LEGAL/ETHICAL/CURRENT EVENTS/HUMANITARIAN/PRO-SOCIAL,Kristen Jaramillo | Evan Nault | Shelly Rauvola | Saruchie Matambanadzo,", University of Houston | , DePaul University | , Tulane Law School",/embedded/session/txIFuC91zxfXmk1Kefw1Z-3npWvIIX%40kh469Fy-hO5k%3D/5146510/?widget=primary
2026,1252,Tedious to Seamless: How AI Transforms Job Task Analysis and Competency Development (Session ID 1252),"Saturday, May 2",9:30 am,10:20 am,R8,TECHNOLOGY/ARTIFICIAL INTELLIGENCE,Mike Katz | David Cassell | Evelina Ignasiak | Mike Shea,", Deloitte | , DePaul University | , APTMetrics",/embedded/session/txIFuC91zxfXmk1Kefw1Z-3npWvIIX%40kh469Fy-hO5k%3D/5146513/?widget=primary
2026,988,"AI Agents at Work: Evidence on Learning, Coaching and Socioemotional Support (Session ID 988)","Saturday, May 2",9:30 am,10:20 am,R9,TECHNOLOGY/ARTIFICIAL INTELLIGENCE,Amal Chekili | Louis Tay | Brooke Macnamara | Feng Guo | Richard Landers,", Virginia Tech | , Purdue University | , University of Tennessee At Chattanooga | , Society for Industrial and Organizational Psychology (APA Div #14)",/embedded/session/txIFuC91zxfXmk1Kefw1Z-3npWvIIX%40kh469Fy-hO5k%3D/5146514/?widget=primary
2026,1344,Beyond the Glass Ceiling: Dominance Stereotypes and Spillover Barriers for Women Lead (Session ID 1344),"Saturday, May 2",10:30 am,11:20 am,202,"DIVERSITY, EQUITY, INCLUSION, AND ACCESSIBILITY",Pratibha Deepak | Feng Guo | Abigail Folberg | Charlotte Moser | Daphna Motro,", University Of Tennessee Chattanooga | , University of Tennessee At Chattanooga | , University of Nebraska - Omaha | , University of Tennessee at Chattanooga | , Hofstra University",/embedded/session/txIFuC91zxfXmk1Kefw1Z-3npWvIIX%40kh469Fy-hO5k%3D/5146515/?widget=primary
2026,1062,"Toss It, Catch It, Fix It: An Interactive Session on Employee Listening (Session ID 1062)","Saturday, May 2",10:30 am,11:20 am,206,ORGANIZATIONAL PROCESSES/DEVELOPMENT/CULTURE,Allen Kamin | Emily Killham | Steven Haverlock | Jonathan Elbaz,", Oracle | , Emily Killham Consulting, Inc. | , Bristol Myers Squibb · Full-time | , Perceptyx",/embedded/session/txIFuC91zxfXmk1Kefw1Z-3npWvIIX%40kh469Fy-hO5k%3D/5146516/?widget=primary
2026,1009,"Framing the Return: Data, Stories, and Lessons on Remote, Hybrid, and On-Site Work (Session ID 1009)","Saturday, May 2",10:30 am,11:20 am,207,ORGANIZATIONAL PROCESSES/DEVELOPMENT/CULTURE,Zachary Warman | Belinda Williams | Chrissy Barnett | Kerya Ball | Paul Tsagaroulis,", Perceptyx | , Southern Glazer's Wine & Spirits | , Moffitt Cancer Center | , Kroger | , University of Virginia",/embedded/session/txIFuC91zxfXmk1Kefw1Z-3npWvIIX%40kh469Fy-hO5k%3D/5146517/?widget=primary
2026,607,“Meaning In” Work or Life Within the Work Stress Framework (Session ID 607),"Saturday, May 2",10:30 am,11:20 am,214,OCCUPATIONAL HEALTH/WORK AND FAMILY,Marcus Fila | Sharon Glazer | Brent Reed | Norbert Semmer | Peter McEachern,", Hope College | , Rutgers, The State University of NJ | , University of North Carolina at Charlotte | , University of Bern, Switzerland | , George Mason University",/embedded/session/txIFuC91zxfXmk1Kefw1Z-3npWvIIX%40kh469Fy-hO5k%3D/5146518/?widget=primary
2026,273,"Executive Assessment in Practice: Tools, Ethics, and Perspectives (Session ID 273)","Saturday, May 2",10:30 am,11:20 am,217,SELECTION/ASSESSMENT/INDIVIDUAL DIFFERENCES,Reece Akhtar | Olaf Ringelband | Joanie Connell | Jon Blankenship | Rodney L. Lowman,", Deeper Signals | , md gesellschaft fuer management-diagnostik mbH | , Flexible Work Solutions | , Tuesday Advisors | , Lowman & Richardson/Consulting Psychologists, PC",/embedded/session/txIFuC91zxfXmk1Kefw1Z-3npWvIIX%40kh469Fy-hO5k%3D/5146519/?widget=primary
2026,612,Basic Interests in Modern Vocational Assessment (Session ID 612),"Saturday, May 2",10:30 am,11:20 am,223,SELECTION/ASSESSMENT/INDIVIDUAL DIFFERENCES,James Rounds | Chu Chu | Phil Lewis | Maura Burke,", University of Illinois at Urbana-Champaign | , University of Illinois, Urbana-Champaign | , National Center for O*NET Development | , HumRRO",/embedded/session/txIFuC91zxfXmk1Kefw1Z-3npWvIIX%40kh469Fy-hO5k%3D/5146520/?widget=primary
2026,1455,Community of Interest: Disruptive Shifts—Navigating Workplace Trauma and Change (Session ID 1455),"Saturday, May 2",10:30 am,11:20 am,228,OCCUPATIONAL HEALTH/WORK AND FAMILY | SPECIAL SESSION,Juliette (Dr. Nelson) Nelson | Brendan Grech | Gerald Goodwin,", JUNURI | , Heroic HR Partners | , Personnel Science Partners",/embedded/session/txIFuC91zxfXmk1Kefw1Z-3npWvIIX%40kh469Fy-hO5k%3D/5146521/?widget=primary
2026,692,Talent Acquisition: A Barrier to Employment for Neurodivergent People? (Session ID 692),"Saturday, May 2",10:30 am,11:20 am,203/204,"DIVERSITY, EQUITY, INCLUSION, AND ACCESSIBILITY",Dr. Brian J. Hoffman | Elisabeth Silver | Adrienne Colella | William Camden | Tania Garcia-Jasso,", University of Georgia | , Michigan State University | , Tulane University | , SHL | , Rice University",/embedded/session/txIFuC91zxfXmk1Kefw1Z-3npWvIIX%40kh469Fy-hO5k%3D/5146522/?widget=primary
2026,1047,Human Strategy or Tech Infrastructure? a Structured Debate on People Analytics’ Future (Session ID 1047),"Saturday, May 2",10:30 am,11:20 am,208/209/210,RESEARCH METHODS/MEASUREMENT/STATISTICS,Carolyn Kalafut | Ia Ko | Jessica Thornton | Brandy Parker | Miti Shah,", Microsoft | , WorkMaru | , athenahealth | , The Coca-Cola Company | , Culture Amp · Full-time",/embedded/session/txIFuC91zxfXmk1Kefw1Z-3npWvIIX%40kh469Fy-hO5k%3D/5146523/?widget=primary
2026,325,Stuck With Reporting? Strategies to Elevate Your People Analytics Game (Session ID 325),"Saturday, May 2",10:30 am,11:20 am,211/212/213,ORGANIZATIONAL PROCESSES/DEVELOPMENT/CULTURE,Sijia Li | Bryan Frank | David Mendelsohn | Doug Reynolds | John Zager | Rebecca Harmata,", PepsiCo | , Nuvance Health | , TechWolf | , APT | , Wonder | , DDI",/embedded/session/txIFuC91zxfXmk1Kefw1Z-3npWvIIX%40kh469Fy-hO5k%3D/5146524/?widget=primary
2026,784,Board Reviews as Learning Systems: Turning Evaluations Into Continuous Development (Session ID 784),"Saturday, May 2",10:30 am,11:20 am,215/216,GROUPS/TEAMS,Melissa Regester | Gregory Fernandes | Keith Goudy | Kristin Mann | Susan Ko,", Vantage Leadership Consulting | , Modern Executive Solutions · Full-time | , YSC",/embedded/session/txIFuC91zxfXmk1Kefw1Z-3npWvIIX%40kh469Fy-hO5k%3D/5146525/?widget=primary
2026,144,The Science of New Hire Surveys: Enhancing Performance Measurement Approaches (Session ID 144),"Saturday, May 2",10:30 am,11:20 am,218/219,JOB PERFORMANCE/WITHDRAWAL/MISBEHAVIOR | CONTENT AREA THEME TRACK,Allison Besl | Steven Hunt | Gabi Danna | Hannah Markell-Goldstein | Isaac Bazian,", Amazon | , Crosschq | , Dropbox | , University of Minnesota",/embedded/session/txIFuC91zxfXmk1Kefw1Z-3npWvIIX%40kh469Fy-hO5k%3D/5146526/?widget=primary
2026,724,Insight to Impact: The Lifecycle of Employee Feedback Surveys (Session ID 724),"Saturday, May 2",10:30 am,11:20 am,220/221/222,"MOTIVATION, ATTITUDES, AND EMOTIONS | CONTENT AREA THEME TRACK",Aarti Polavarapu | Andy Kemp | Jason Guttadauria Ph.D. | Melissa Sorensen | Thaddeus Rada-Bayne | Ziyad Muflahi | Sami Nesnidol,", Bowling Green State University | , Gallup | , JSG Advisory LLC | , Culture Amp | , Ford Motor Company | , Atlassian · Full-time",/embedded/session/txIFuC91zxfXmk1Kefw1Z-3npWvIIX%40kh469Fy-hO5k%3D/5146527/?widget=primary
2026,916,Hiring Sweet Spot: Practicality and Ideals in Integrating Assessments and Interviews (Session ID 916),"Saturday, May 2",10:30 am,11:20 am,225/226,SELECTION/ASSESSMENT/INDIVIDUAL DIFFERENCES,Carter Wheelock | Marie Childers | Dr. Alissa D. Parr | Jamie Winter | Lindsey Freier | Matt O'Connor | Dr. Scott Highhouse,", MilliporeSigma · Internship | , Southern Illinois University Edwardsville | , Talogy | , APTMetrics | , Fresenius Medical Care | , Owens Corning | , Bowling Green State University",/embedded/session/txIFuC91zxfXmk1Kefw1Z-3npWvIIX%40kh469Fy-hO5k%3D/5146528/?widget=primary
2026,343,Want to Publish Your Paper: Journal Editor Perspectives (Session ID 343),"Saturday, May 2",10:30 am,11:20 am,B2-1,I-O PSYCHOLOGIST CAREER DEVELOPMENT/TEACHING | CONTENT AREA THEME TRACK,Wei Yang Sim | Cort Rudolph | Lillian Eby | Roni Reiter-Palmon | Sylvia Roch,", University of Albany, SUNY | , Wayne State University | , University of Georgia | , University of Nebraska at Omaha | , University at Albany, SUNY",/embedded/session/txIFuC91zxfXmk1Kefw1Z-3npWvIIX%40kh469Fy-hO5k%3D/5146529/?widget=primary
2026,1145,From Messy to Masterful: Applied Research Data Challenges and Creative Solutions (Session ID 1145),"Saturday, May 2",10:30 am,11:20 am,B2-2,RESEARCH METHODS/MEASUREMENT/STATISTICS | CONTENT AREA THEME TRACK,Suzanne Bell | Goran Kuljanin | Karyssa Courey | Deanna Kennedy | Lauren Landon | C. Shawn Burke | Sydney Begerowski,", NASA - National Aeronautics and Space Administration | , DePaul University | , Rice University | , Western Washington University · Full-time | , NASA (KBR) | , University of Central Florida",/embedded/session/txIFuC91zxfXmk1Kefw1Z-3npWvIIX%40kh469Fy-hO5k%3D/5146530/?widget=primary
2026,,Selection/Assessment/Individual Differences Posters,"Saturday, May 2",10:30 am,11:20 am,Exhibit Hall,POSTER | SELECTION/ASSESSMENT/INDIVIDUAL DIFFERENCES,,,
2026,608,"Hot Takes, Hot Wings: A Spicy Conversation With I-O Psychology’s Thought Leaders (Session ID 608)","Saturday, May 2",10:30 am,11:20 am,R1,I-O PSYCHOLOGIST CAREER DEVELOPMENT/TEACHING,Alexis Fink | Colby Nesbitt | Nathan Carter | Satoris Howes | Jp Elliott,", Propeller Insight, LLC | , Netflix | , Oregon State University | , Future of HR Consulting",/embedded/session/txIFuC91zxfXmk1Kefw1Z-3npWvIIX%40kh469Fy-hO5k%3D/5146568/?widget=primary
2026,,Beyond the Niche: I-Os’ Fight for Business Relevance (Session ID1071),"Saturday, May 2",10:30 am,11:20 am,R2,I-O PSYCHOLOGIST CAREER DEVELOPMENT/TEACHING,Jürgen Bank | Jared Weintraub | Krystina Moustakis,", FoundrsFuel | , Deloitte | , Uber",/embedded/session/txIFuC91zxfXmk1Kefw1Z-3npWvIIX%40kh469Fy-hO5k%3D/5146569/?widget=primary
2026,1412,Mentoring in I-O: Lessons Learned From Applying Mentorship to Our Field (Session ID 1412),"Saturday, May 2",10:30 am,11:20 am,R3,TRAINING/COACHING/MENTORING,Janis Ward | Rik Nemanick | Riley Morrison | Riza Yamat Leak | Yicheng Xue,", J. M. Ward Consulting | , Nemanick Leadership Consulting | , MiTek | , Trim-Tex, Inc | , Baruch College and Graduate Center, CUNY",/embedded/session/txIFuC91zxfXmk1Kefw1Z-3npWvIIX%40kh469Fy-hO5k%3D/5146570/?widget=primary
2026,444,Executive Presence: A Gatekeeping Mechanism in Leadership Advancement (Session ID 444),"Saturday, May 2",10:30 am,11:20 am,R4,LEADERSHIP/LEADER DEVELOPMENT,"Natalie Lamb | Richard Harvey | Eileen Toomey | Kaytlynn Griswold | Kelly Hamilton, PhD | Maya Gann-Bociek | Meisha-Ann Martin",", Saint Louis University | , St. Louis University | , Johnson & Johnson | , PepsiCo | , CMA Global Inc | , Southern Illinois University Edwardsville | , Workhuman",/embedded/session/txIFuC91zxfXmk1Kefw1Z-3npWvIIX%40kh469Fy-hO5k%3D/5146571/?widget=primary
2026,588,"360 Surveys: Stuck in Time, or Ready to Revolutionize the Future of Talent? (Session ID 588)","Saturday, May 2",10:30 am,11:20 am,R5,LEADERSHIP/LEADER DEVELOPMENT,Paul Wilson | Brian Ruggeberg | Dr. Kyle D. McNeal | Kevin Dooley,", BTS | , Spencer Stuart | , Merck | , KMD Services",/embedded/session/txIFuC91zxfXmk1Kefw1Z-3npWvIIX%40kh469Fy-hO5k%3D/5146572/?widget=primary
