conference_year,display_session_id,title,date_label,start_time,end_time,location,tracks,speakers,speaker_affiliations,detail_href
2026,868,Nudging Leaders Forward: Interventions to Enhance Organizational Decision-Making (Session ID 868),"Friday, May 1",9:00 am,10:20 am,203/204,LEADERSHIP/LEADER DEVELOPMENT,Nandini Mehta | Alyssa Ortega | Amanda Julian | Bradley Brummel | Kaytlynn Griswold | Melissa Regester,", University of Houston | , Vantage Leadership Consulting | , Monark | , PepsiCo",/embedded/session/txIFuC91zxfXmk1Kefw1Z-3npWvIIX%40kh469Fy-hO5k%3D/5146093/?widget=primary
2026,887,AI Goes to College: Practical Tools for Navigating AI in the Classroom (Session ID 887),"Friday, May 1",9:00 am,10:20 am,208/209/210,I-O PSYCHOLOGIST CAREER DEVELOPMENT/TEACHING,Annie Kato | Cristina Rubino | Loren Naidoo | Satoris Howes | Michael Ekema,", Seattle Pacific University | , California State University, Northridge | , Oregon State University | , CSU-Long Beach",/embedded/session/txIFuC91zxfXmk1Kefw1Z-3npWvIIX%40kh469Fy-hO5k%3D/5146094/?widget=primary
2026,358,Building Process Theory Using Field Data and Computational Models (Session ID 358),"Friday, May 1",9:00 am,10:20 am,211/212/213,ORGANIZATIONAL PROCESSES/DEVELOPMENT/CULTURE,Ajay Somaraju | Jenna Bowker | Daniel Griffin,", Binghamton University | , University of South Florida",/embedded/session/txIFuC91zxfXmk1Kefw1Z-3npWvIIX%40kh469Fy-hO5k%3D/5146095/?widget=primary
2026,770,Withdrawal From Work: Contemporary Manifestations and Personality Predictors (Session ID 770),"Friday, May 1",9:00 am,10:20 am,215/216,JOB PERFORMANCE/WITHDRAWAL/MISBEHAVIOR,Michael Hazboun | Deniz Ones | Brittany Mercado | Ziyu Ren | Stephan Dilchert,", University of Minnesota- Twin Cities | , University of Minnesota · Full-time | , Elon University | , University of Minnesota, Twin Cities | , Zicklin School of Business",/embedded/session/txIFuC91zxfXmk1Kefw1Z-3npWvIIX%40kh469Fy-hO5k%3D/5146096/?widget=primary
2026,1023,"The Central Role of Communication in Teams: Performance, Adaptation, and Well-Being (Session ID 1023)","Friday, May 1",9:00 am,10:20 am,218/219,GROUPS/TEAMS | CONTENT AREA THEME TRACK,Allison Kom | Caton Weinberger | Cooper Drose | Cynthia Maupin | Kaushik Ram,", Colorado State University | , Michigan State University | , Korn Ferry | , University of Mississippi | , San Jose State University",/embedded/session/txIFuC91zxfXmk1Kefw1Z-3npWvIIX%40kh469Fy-hO5k%3D/5146097/?widget=primary
2026,1215,Stress as Offense to Self: New Understanding of Illegitimacy at Work (Session ID 1215),"Friday, May 1",9:00 am,10:20 am,220/221/222,OCCUPATIONAL HEALTH/WORK AND FAMILY | CONTENT AREA THEME TRACK,Marcus Fila | Wiston Rodriguez | DuBois Barnes | Kelly Nguyen | Marcel Kern | Taylor Flinn,", Hope College | , San Diego State University | , Auburn University | , Baruch College | , University of Göttingen",/embedded/session/txIFuC91zxfXmk1Kefw1Z-3npWvIIX%40kh469Fy-hO5k%3D/5146098/?widget=primary
2026,393,Will AI Save or Replace Assessment Centers? A Debate on the Future (Session ID 393),"Friday, May 1",9:00 am,10:20 am,225/226,SELECTION/ASSESSMENT/INDIVIDUAL DIFFERENCES,"Brad Chambers | Christina Norris-Watts | Doug Reynolds | Lynn Collins, Ph.D. | Michael Bazigos | Suzanne Tsacoumis",", BTS | , Johnson & Johnson | , APT | , Columbia University in the City of New York | , HumRRO",/embedded/session/txIFuC91zxfXmk1Kefw1Z-3npWvIIX%40kh469Fy-hO5k%3D/5146099/?widget=primary
2026,631,The Heart of Leadership: Understanding How Leaders Shape and Carry Emotions (Session ID 631),"Friday, May 1",9:00 am,10:20 am,B2-1,LEADERSHIP/LEADER DEVELOPMENT | CONTENT AREA THEME TRACK,Jane Thomas | Courtney Williams | Alicia Grandey | Hector Madrid | Tiffany Paquin,", Purdue University Northwest | , Grand Valley State University | , Universidad Adolfo Ibanez, Chile | , Toronto Metropolitan University",/embedded/session/txIFuC91zxfXmk1Kefw1Z-3npWvIIX%40kh469Fy-hO5k%3D/5146100/?widget=primary
2026,525,Pushing the Boundaries of Personality Science in the Workplace (Session ID 525),"Friday, May 1",9:00 am,10:20 am,B2-2,SELECTION/ASSESSMENT/INDIVIDUAL DIFFERENCES | CONTENT AREA THEME TRACK,Bart Wille | Brian Connelly | Samiat Ishola | Sang Eun Woo | Sofie Dupré | Theresa Leyens,", Ghent University | , University of Toronto | , Virginia Tech | , Purdue University | , Vrije Universiteit Brussel",/embedded/session/txIFuC91zxfXmk1Kefw1Z-3npWvIIX%40kh469Fy-hO5k%3D/5146101/?widget=primary
2026,,"Diversity, Equity, Inclusion, and Accessibility Posters","Friday, May 1",9:00 am,9:50 am,Exhibit Hall,"POSTER | DIVERSITY, EQUITY, INCLUSION, AND ACCESSIBILITY",,,
2026,888,Recent Advances in Research on Careless Responding to Surveys and Tests (Session ID 888),"Friday, May 1",9:00 am,10:20 am,R1,RESEARCH METHODS/MEASUREMENT/STATISTICS,David Sexton | Mark Ramsey | Rusty Wilson | Cory Moore,", University of Central Florida | , Research Scientist | , Hirevue",/embedded/session/txIFuC91zxfXmk1Kefw1Z-3npWvIIX%40kh469Fy-hO5k%3D/5146127/?widget=primary
2026,546,Advancing I-O Science With Organizational Data (Session ID 546),"Friday, May 1",9:00 am,10:20 am,R2,RESEARCH METHODS/MEASUREMENT/STATISTICS,Richard Guzzo | Marcus Dickson | Michael Ford | Paul Bliese,", Workforce Sciences Institute | , Wayne State University | , University of Alabama | , Darla Moore School of Business",/embedded/session/txIFuC91zxfXmk1Kefw1Z-3npWvIIX%40kh469Fy-hO5k%3D/5146128/?widget=primary
2026,202,Taking Action on Survey Data With a Deskless Workforce (Session ID 202),"Friday, May 1",9:00 am,10:20 am,R4,"MOTIVATION, ATTITUDES, AND EMOTIONS",Belinda Williams | Brian Jefferis | Drew Lam | Mallory Wright | Casey Witherspoon,", Southern Glazer's Wine & Spirits | , Qualtrics | , PepsiCo | , SGWS | , Target",/embedded/session/txIFuC91zxfXmk1Kefw1Z-3npWvIIX%40kh469Fy-hO5k%3D/5146130/?widget=primary
2026,764,Learning From Labor: (Re)Connecting Work Psychology With Unions (Session ID 764),"Friday, May 1",9:00 am,10:20 am,R5,LEGAL/ETHICAL/CURRENT EVENTS/HUMANITARIAN/PRO-SOCIAL,George Alliger | Leslie Hammer | Jason Phillips | Keaton Fletcher | Lisa Kath | Lauren Kuykendall | Michael Zickar | Peter McEachern | Ryszard Koziel,", Consulting Work Psychologist | , Oregon Health & Science University | , Baruch College & CUNY Graduate Center | , Colorado State University | , San Diego State University | , George Mason University | , Bowling Green State University | , Saint Louis University School of Medicine",/embedded/session/txIFuC91zxfXmk1Kefw1Z-3npWvIIX%40kh469Fy-hO5k%3D/5146131/?widget=primary
2026,832,Innovation in Skills Assessment Development: Open Space to Build Scalable Strategies (Session ID 832),"Friday, May 1",9:00 am,10:20 am,R6,RESEARCH METHODS/MEASUREMENT/STATISTICS,Lauren Park | Marian Pitel-Wali | Ruth Imose,", SAP | , Workera | , Johnson & Johnson",/embedded/session/txIFuC91zxfXmk1Kefw1Z-3npWvIIX%40kh469Fy-hO5k%3D/5146133/?widget=primary
2026,507,What Is Your Dangerous Idea? Reimagining the Future of Employee Surveys (Session ID 507),"Friday, May 1",9:00 am,10:20 am,R9,RESEARCH METHODS/MEASUREMENT/STATISTICS,"Desmond Leung | Julian Allen | Randy Lim | Nabila Sheikh-Hashmi | Payton Stewart | Ryan Horn, PhD | Scott Brooks",", Intuitive | , Alnylam Pharmaceuticals | , McKinsey & Company | , Saks Global | , Leadership Development Institute - LSU | , OrgVitality | , PespiCo",/embedded/session/txIFuC91zxfXmk1Kefw1Z-3npWvIIX%40kh469Fy-hO5k%3D/5146134/?widget=primary
2026,1207,Talent Hackathon AI Edition: Group Brainstorming for Talent Challenges in An AI World (Session ID 1207),"Friday, May 1",9:00 am,10:20 am,R8,TECHNOLOGY/ARTIFICIAL INTELLIGENCE,Erica Desrosiers | Matthew Dreyer | A. Silke McCance | Michael Ehret | Pamela Congemi | Seth Kamen,", Johnson Controls | , Prudential Financial | , Procter & Gamble | , Johnson & Johnson | , Advanced Sterilization Products | , People Solutions",/embedded/session/txIFuC91zxfXmk1Kefw1Z-3npWvIIX%40kh469Fy-hO5k%3D/5146135/?widget=primary
2026,,Are You Smarter Than an MBA? An AI-Powered Upskill on Business and Financial Acumen (Session ID1091),"Friday, May 1",9:00 am,10:20 pm,R7,I-O PSYCHOLOGIST CAREER DEVELOPMENT/TEACHING,Aqsa Ali | Kareem Panton,", BTS | , American Express",/embedded/session/txIFuC91zxfXmk1Kefw1Z-3npWvIIX%40kh469Fy-hO5k%3D/5146040/?widget=primary
2026,,Career Open House,"Friday, May 1",9:00 am,11:00 am,Great Hall B,I-O PSYCHOLOGIST CAREER DEVELOPMENT/TEACHING | EVENTS & RECEPTIONS,,,/embedded/session/txIFuC91zxfXmk1Kefw1Z-3npWvIIX%40kh469Fy-hO5k%3D/5241555/?widget=primary
2026,,"Partner Showcase: Aon Talent Solutions - Work Rewired: AI's Impact on the Workforce, Talent Assessment, and the Candidate Experience","Friday, May 1",9:00 am,10:20 am,224,SPONSORED,Ernie Paskey | Melissa Champine | Lauren Lilly | Maged Natanios | Scott Reithel,", Aon | , Aon Talent Assessments | , Marriott International",/embedded/session/txIFuC91zxfXmk1Kefw1Z-3npWvIIX%40kh469Fy-hO5k%3D/5256082/?widget=primary
2026,1115,Identity Management of Employees With Invisible Disabilities: Strategies and Costs (Session ID 1115),"Friday, May 1",10:30 am,11:20 am,202,"DIVERSITY, EQUITY, INCLUSION, AND ACCESSIBILITY",Arturia Melson-Silimon | Dr. Brian J. Hoffman | Tim Vogus | Alecia Santuzzi | Cassidy Gaddie | Jessica Gass,", Virginia Tech | , University of Georgia | , Vanderbilt University Owen Graduate School of Management | , Northern Illinois University | , American Psychological Association",/embedded/session/txIFuC91zxfXmk1Kefw1Z-3npWvIIX%40kh469Fy-hO5k%3D/5146136/?widget=primary
2026,388,"Candidate Feedback Now, Next, and Beyond: Building a Better Applicant Experience (Session ID 388)","Friday, May 1",10:30 am,11:20 am,206,ORGANIZATIONAL PROCESSES/DEVELOPMENT/CULTURE,Nataliya Baytalskaya | Alanna Harrington | Jesse Caylor | Johanna Lascano | Daniel Miller,", Talogy | , Procter & Gamble | , Infor Talent Science | , SHL",/embedded/session/txIFuC91zxfXmk1Kefw1Z-3npWvIIX%40kh469Fy-hO5k%3D/5146137/?widget=primary
2026,,Overlooked Reproductive Experiences: Expanding the Lens on Maternity at Work (Session ID1067),"Friday, May 1",10:30 am,11:20 am,207,OCCUPATIONAL HEALTH/WORK AND FAMILY,Candice Thomas | Yon-Jin Suh | Angela Grotto | Haley Cobb | Nada Basir | Vanessa Burke | Winny Shen,", Arizona State University | , Montclair State University | , Louisiana State University | , Conrad School of Entrepreneurship and Business | , York University",/embedded/session/txIFuC91zxfXmk1Kefw1Z-3npWvIIX%40kh469Fy-hO5k%3D/5146138/?widget=primary
2026,487,Does Remote Work Impair Employee Well-Being? It Depends! (Session Id 487),"Friday, May 1",10:30 am,11:20 am,214,OCCUPATIONAL HEALTH/WORK AND FAMILY,Marta Mohedano Jurado | Melissa Robertson | Daniela Ortega | Fiyinfunjah Dosumu | Meaghan Tracy,", University of Georgia | , San Diego State University and Southwestern Community College District | , Virginia Polytechnic Institute and State University | , Purdue University",/embedded/session/txIFuC91zxfXmk1Kefw1Z-3npWvIIX%40kh469Fy-hO5k%3D/5146140/?widget=primary
2026,125,Recommitting to Coaching in the Era of AI (Session ID 125),"Friday, May 1",10:30 am,11:20 am,217,TRAINING/COACHING/MENTORING,Gina Thoebes | Marc Sokol | Jonathan Reitz,", Arizona Cardinals | , Sage Consulting Resources | , FLUXIFY",/embedded/session/txIFuC91zxfXmk1Kefw1Z-3npWvIIX%40kh469Fy-hO5k%3D/5146141/?widget=primary
2026,793,The Career Carousel: Insights Into the Job Hopping Phenomenon (Session ID 793),"Friday, May 1",10:30 am,11:20 am,223,SELECTION/ASSESSMENT/INDIVIDUAL DIFFERENCES,Aarti Polavarapu | Sabrina Yu | Asha Isaacs | Andy Kemp | Garett Foster | Jenna-Lyn Roman | Margaret Brooks,", Bowling Green State University | , Gallup | , Google | , Target | , Kennesaw State University",/embedded/session/txIFuC91zxfXmk1Kefw1Z-3npWvIIX%40kh469Fy-hO5k%3D/5146142/?widget=primary
2026,1129,Beyond Engagement: Tackling Organizational Disconnection in Modern Work Psychology (Session ID 1129),"Friday, May 1",10:30 am,11:20 am,203/204,ORGANIZATIONAL PROCESSES/DEVELOPMENT/CULTURE,John Cooper | Autumn Krauss | Adrian Furnham | John Weiner | Kira Van Niekerk | Stephen Cuppello,", SAP SuccessFactors | , ACT | , Thomas",/embedded/session/txIFuC91zxfXmk1Kefw1Z-3npWvIIX%40kh469Fy-hO5k%3D/5146143/?widget=primary
2026,807,Do It Yourself: Proactively Addressing Blind Spots in I-O Training (Session ID 807),"Friday, May 1",10:30 am,11:20 am,208/209/210,I-O PSYCHOLOGIST CAREER DEVELOPMENT/TEACHING,Dr. Andrew M. Naber | Brian Lewis | Kelly Dray | Linden Wooderson | Priyanka Dave | Rosalyn Stoa | Sage Aronson | Samantha January | Brandon King,", Cognitive Performance Group | , CUNY Graduate Center/Baruch College | , Lennar | , The Guitar Center Company | , Oregon State University | , The Aldridge Group | , CUNY Graduate Center/Baruch | , HP Inc. | , Bechtel",/embedded/session/txIFuC91zxfXmk1Kefw1Z-3npWvIIX%40kh469Fy-hO5k%3D/5146144/?widget=primary
2026,194,Bridging Disciplines for Worker Well-Being: An Interdisciplinary IGNITE (Session ID 194),"Friday, May 1",10:30 am,11:20 am,211/212/213,OCCUPATIONAL HEALTH/WORK AND FAMILY,Brent Oja | Destiny Castro | Gabriela Fernandez Castillo | Hannah Perkins Stark | Jensine Paoletti-Hatcher | Julia Beckel | Ryan Duffy | Zainab Nazir,", Louisiana State University | , Rice University | , Portland State University | , Federal Aviation Administration | , University of Florida",/embedded/session/txIFuC91zxfXmk1Kefw1Z-3npWvIIX%40kh469Fy-hO5k%3D/5146145/?widget=primary
2026,382,When Engagement Becomes a Performance Metric: Ensuring Fair Use in Evaluations (Session ID 382),"Friday, May 1",10:30 am,11:20 am,215/216,JOB PERFORMANCE/WITHDRAWAL/MISBEHAVIOR,Morgan Rose Taylor | David Ostberg | Jennifer Cullen | Kristin Saboe | Stephanie Andel,", Culture Amp | , Medallia | , Visa | , Google | , Dell Technologies",/embedded/session/txIFuC91zxfXmk1Kefw1Z-3npWvIIX%40kh469Fy-hO5k%3D/5146146/?widget=primary
2026,1188,Beyond Average: Advances in Team Composition and Approaches to Multilevel Data (Session ID 1188),"Friday, May 1",10:30 am,11:20 am,218/219,GROUPS/TEAMS | CONTENT AREA THEME TRACK,Alexandra Harris-Watson | Jeffrey Masser | Tiffany Bisbey | Dorothy Carter | Jordan Johnson | Quan Nguyen,", Purdue University | , The George Washington University | , Michigan State University | , Clemson University | , Pomona College",/embedded/session/txIFuC91zxfXmk1Kefw1Z-3npWvIIX%40kh469Fy-hO5k%3D/5146147/?widget=primary
2026,1127,The Personal and Organizational Costs of Unhelpful and Imbalanced Support at Work (Session ID 1127),"Friday, May 1",10:30 am,11:20 am,220/221/222,OCCUPATIONAL HEALTH/WORK AND FAMILY | CONTENT AREA THEME TRACK,Kristen Black | Jacob Lamprecht | Andrea Hetrick | Sarah Rohr,", University of Tennessee at Chattanooga | , University Of Tennessee At Chattanooga | , University of New Mexico | , Bowling Green State University",/embedded/session/txIFuC91zxfXmk1Kefw1Z-3npWvIIX%40kh469Fy-hO5k%3D/5146148/?widget=primary
2026,559,Practicing What We Preach: Integrating “I” and “O” Psychology in Applied Fieldwork (Session ID 559),"Friday, May 1",10:30 am,11:20 am,225/226,SELECTION/ASSESSMENT/INDIVIDUAL DIFFERENCES,Thisali Mendis | Anne Winkhart | Jessica Zalewski | Jonas Sutphin | Kaitlin Busse | Lauren Kiproff-Downer | Laura Johnson | Luke Kayga,", George Mason University | , The University of Akron | , DICK'S Sporting Goods | , BTS | , Google | , Perpara Organizational Development Consulting | , SIGMA Assessment Systems | , Culture Amp",/embedded/session/txIFuC91zxfXmk1Kefw1Z-3npWvIIX%40kh469Fy-hO5k%3D/5146149/?widget=primary
2026,420,"High Impact HiPo Programs in Large Enterprises: Evidence, Practice, and Future Trends (Session ID 420)","Friday, May 1",10:30 am,11:20 am,B2-1,LEADERSHIP/LEADER DEVELOPMENT | CONTENT AREA THEME TRACK,Ted Kinney | Dr. Alissa D. Parr | Danielle Wittorp | Leslie Golay | Raphael Prager,", Talogy | , Owens Corning | , Nike | , Walmart",/embedded/session/txIFuC91zxfXmk1Kefw1Z-3npWvIIX%40kh469Fy-hO5k%3D/5146150/?widget=primary
2026,1285,Practice Makes Prepared: New Insights Into Test Preparation and Employment Assessment (Session ID 1285),"Friday, May 1",10:30 am,11:20 am,B2-2,SELECTION/ASSESSMENT/INDIVIDUAL DIFFERENCES | CONTENT AREA THEME TRACK,Emily Campion | Karim Badr | Nicholas Baldwin | Tyler Mirando | Victor Ellingsen,", University of Iowa | , SHL | , DCS Corporation | , Citizens Bank",/embedded/session/txIFuC91zxfXmk1Kefw1Z-3npWvIIX%40kh469Fy-hO5k%3D/5146151/?widget=primary
2026,,"Diversity, Equity, Inclusion, and Accessibility Posters","Friday, May 1",10:30 am,11:20 am,Exhibit Hall,"POSTER | DIVERSITY, EQUITY, INCLUSION, AND ACCESSIBILITY",,,
2026,297,"Early Career, Real Talk: Perspectives From the Next Generation of I-O Professionals (Session ID 297)","Friday, May 1",10:30 am,11:20 am,R1,I-O PSYCHOLOGIST CAREER DEVELOPMENT/TEACHING,Amanda Laganosky | Katerina Feddersen | Anthony Naranjo | Joezer Nolasco | Moses Rivera,", Wescom Financial | , Dayforce | , Publix Supermarkets | , Niagara Bottling | , AUM (Auburn University at Montgomery)",/embedded/session/txIFuC91zxfXmk1Kefw1Z-3npWvIIX%40kh469Fy-hO5k%3D/5146178/?widget=primary
2026,462,"AI in Employee Selection Update III: State, Federal, and Litigation Updates (Session ID 462)","Friday, May 1",10:30 am,11:20 am,R2,LEGAL/ETHICAL/CURRENT EVENTS/HUMANITARIAN/PRO-SOCIAL,Bre Timko | Cliff Haimann | David Schmidt | Niloy Ray,", DCI Consulting | , Morgan, Lewis & Bockius LLP | , DCI Consulting Group, Inc. | , Littler",/embedded/session/txIFuC91zxfXmk1Kefw1Z-3npWvIIX%40kh469Fy-hO5k%3D/5146179/?widget=primary
2026,759,"Simple, Seriously: Applying the Power of Simplicity to Employee Listening (Session ID 759)","Friday, May 1",10:30 am,11:20 am,R3,"MOTIVATION, ATTITUDES, AND EMOTIONS",Boris Genzer | Zachary Warman | Christopher Adair | Yael Oelbaum | Brandy Parker,", Marriott | , Perceptyx | , General Motors | , JetBlue | , The Coca-Cola Company",/embedded/session/txIFuC91zxfXmk1Kefw1Z-3npWvIIX%40kh469Fy-hO5k%3D/5146180/?widget=primary
2026,941,Modeling Mindsets for Modern Organizations: Cultivating Statistical Thinking in I-O (Session ID 941),"Friday, May 1",10:30 am,11:20 am,R5,RESEARCH METHODS/MEASUREMENT/STATISTICS,Denvar Summers | Karyssa Courey,", City St George's, The University of London | , Rice University",/embedded/session/txIFuC91zxfXmk1Kefw1Z-3npWvIIX%40kh469Fy-hO5k%3D/5146181/?widget=primary
2026,55,Measuring Creativity: Exploring Assessment Challenges and Innovations (Session ID 55),"Friday, May 1",10:30 am,11:20 am,R6,RESEARCH METHODS/MEASUREMENT/STATISTICS,Jackie Martin Kowal | Cary Stothart | Roni Reiter-Palmon,", PDRI | , US Army | , University of Nebraska at Omaha",/embedded/session/txIFuC91zxfXmk1Kefw1Z-3npWvIIX%40kh469Fy-hO5k%3D/5146182/?widget=primary
2026,534,Agentic AI at Work: Augmenting the Nature and Future of Work (Session ID 534),"Friday, May 1",10:30 am,11:20 am,R7,TECHNOLOGY/ARTIFICIAL INTELLIGENCE,Sean Noble | Yizhen Egyn Zhu | Eric Sydell | Louis Hickman | Ben Porr | Weiwen Nie,", Capital One | , Amazon | , Vero AI | , Harver | , Hogan Assessments",/embedded/session/txIFuC91zxfXmk1Kefw1Z-3npWvIIX%40kh469Fy-hO5k%3D/5146183/?widget=primary
2026,982,Unpacking Creativity With AI: A Phase-Based Exploration of Creative Problem-Solving Activities (Session ID 982),"Friday, May 1",10:30 am,11:20 am,R8,TECHNOLOGY/ARTIFICIAL INTELLIGENCE,Ares Boira Lopez | Emma Theobald | Josie Koubek | Margaret Shercliffe,", University of Nebraska, National Counterterrorism Innovation, Technology and Education (NCITE) Center | , University of Nebraska at Omaha | , University of Oklahoma | , Graduate Student - University of Nebraska at Omaha",/embedded/session/txIFuC91zxfXmk1Kefw1Z-3npWvIIX%40kh469Fy-hO5k%3D/5146184/?widget=primary
2026,1161,"Me, Myself, and AI: How I-Os Are Using AI for Personal Development (Session ID 1161)","Friday, May 1",10:30 am,11:20 am,R9,TECHNOLOGY/ARTIFICIAL INTELLIGENCE,Cassie Colton | Lindsey Burke | Megan Leasher | Matthew Lemming | Ngoc Duong | Scott Hurst | Taylor Sullivan,", BMS | , Talogy | , Cincinnati Children's Hospital & Medical Center | , Hogan Assessments | , Amazon | , Workera",/embedded/session/txIFuC91zxfXmk1Kefw1Z-3npWvIIX%40kh469Fy-hO5k%3D/5146185/?widget=primary
2026,1472,The I-O Psychology Certification: An Update (Session ID 1472),"Friday, May 1",10:30 am,11:20 am,R4,I-O PSYCHOLOGIST CAREER DEVELOPMENT/TEACHING | LEGAL/ETHICAL/CURRENT EVENTS/HUMANITARIAN/PRO-SOCIAL | SPECIAL SESSION,Mark Nagy | Matt Turner | Liberty Munson | Sarah Carroll | Chad Buckendahl,", Wendal, Inc. | , Psychology Credentialing Center (update name) | , Microsoft | , National Board for Certification in Occupational Therapy, Inc. (NBCOT) | , Alpine Testing Solutions",/embedded/session/txIFuC91zxfXmk1Kefw1Z-3npWvIIX%40kh469Fy-hO5k%3D/5158311/?widget=primary
2026,,"Partner Showcase: Pinsight - AI is Ready. Are your Leaders? What 14,000 Leadership Assessments Reveal About Why AI Adoption Stalls","Friday, May 1",10:30 am,11:20 am,224,SPONSORED,Martin Lanik | Amy Huber,", Pinsight",/embedded/session/txIFuC91zxfXmk1Kefw1Z-3npWvIIX%40kh469Fy-hO5k%3D/5256083/?widget=primary
2026,,Midday Break,"Friday, May 1",11:30 am,1:00 pm,,"BREAKFAST, LUNCH & BREAKS",,,
2026,,I-O Psychology for Great Good,"Friday, May 1",12:00 pm,1:00 pm,208/209/210,EVENTS & RECEPTIONS,,,/embedded/session/txIFuC91zxfXmk1Kefw1Z-3npWvIIX%40kh469Fy-hO5k%3D/5289478/?widget=primary
2026,394,One Big Beautiful Presentation: EEOC/OFCCP/DEI Annual Update (Session Id 394),"Friday, May 1",1:00 pm,1:50 pm,202,"DIVERSITY, EQUITY, INCLUSION, AND ACCESSIBILITY",Chris Patrick | Katey Foster | Eric Dunleavy | Mike Aamodt,", Jackson Lewis | , APTMetrics | , DCI Consulting Group, Inc. | , DCI Consulting Group",/embedded/session/txIFuC91zxfXmk1Kefw1Z-3npWvIIX%40kh469Fy-hO5k%3D/5146186/?widget=primary
2026,1173,From Art to Science: Rethinking the Discipline of Organizational Design (Session ID 1173),"Friday, May 1",1:00 pm,1:50 pm,206,ORGANIZATIONAL PROCESSES/DEVELOPMENT/CULTURE,Aaron Sorensen | Courtney Paynter | Lane Siedor | Christopher Mason,", Lotis Blue Consulting | , AbbVie | , orgvue | , Amylu Foods",/embedded/session/txIFuC91zxfXmk1Kefw1Z-3npWvIIX%40kh469Fy-hO5k%3D/5146187/?widget=primary
2026,478,From Disruption to Direction: Charting the Future of Organizational Practices (Session ID 478),"Friday, May 1",1:00 pm,1:50 pm,207,ORGANIZATIONAL PROCESSES/DEVELOPMENT/CULTURE,Breanna Green | Gabriela Sedotto | Laura Joiner | Maryam Ahmad Kazmi | Nikola Fedorowicz | Susan D'Mello,", Cornell University | , Regeneron | , Demandbase | , Google",/embedded/session/txIFuC91zxfXmk1Kefw1Z-3npWvIIX%40kh469Fy-hO5k%3D/5146188/?widget=primary
2026,351,The Critical Role of Context in Counterproductive Work Behavior Research (Session ID 351),"Friday, May 1",1:00 pm,1:50 pm,214,JOB PERFORMANCE/WITHDRAWAL/MISBEHAVIOR,Brian Lyons | Nathan Bowling | Steve Jex | Bradley Brummel | Brittany Mercado | Kelly Nguyen,", Elon University | , University of Central Florida | , University of Houston | , Baruch College",/embedded/session/txIFuC91zxfXmk1Kefw1Z-3npWvIIX%40kh469Fy-hO5k%3D/5146189/?widget=primary
2026,441,Context Matters: Determinants of Work-Relevant Learning Across the Career Span (Session ID 441),"Friday, May 1",1:00 pm,1:50 pm,217,TRAINING/COACHING/MENTORING,Jenny Erickson | Makai Ruffin | Drew Jauron | Emma Desrosiers,", MD Anderson Cancer Center | , Rice University | , University of Iowa | , Penn State University",/embedded/session/txIFuC91zxfXmk1Kefw1Z-3npWvIIX%40kh469Fy-hO5k%3D/5146190/?widget=primary
2026,470,"Guiding Aligned Career Decisions: Assessment, Feedback, and Social Context (Session ID 470)","Friday, May 1",1:00 pm,1:50 pm,223,SELECTION/ASSESSMENT/INDIVIDUAL DIFFERENCES,Layla Dang | Ahleah Miles | Nazli Nero | Xin Wei Ong,", Michigan State University | , The University of Akron",/embedded/session/txIFuC91zxfXmk1Kefw1Z-3npWvIIX%40kh469Fy-hO5k%3D/5146191/?widget=primary
2026,190,My Worst I-O Day Ever: Turning Nightmares Into Wisdom (Session ID 190),"Friday, May 1",1:00 pm,1:50 pm,203/204,ORGANIZATIONAL PROCESSES/DEVELOPMENT/CULTURE,Elizabeth Kolmstetter | Megan Leasher | Erica Desrosiers | Kristin Saboe | Vanessa Vershaw,", Cybersecurity and Infrastructure Security Agency (Retired) | , Cincinnati Children's Hospital & Medical Center | , Johnson Controls | , Google | , The Vanessa Vershaw Group · Self-employed",/embedded/session/txIFuC91zxfXmk1Kefw1Z-3npWvIIX%40kh469Fy-hO5k%3D/5146192/?widget=primary
2026,1118,Reimagining Meetings: Sharing Research and Practical Lessons to Inspire Interventions (Session ID 1118),"Friday, May 1",1:00 pm,1:50 pm,208/209/210,GROUPS/TEAMS,Jon Willford | Jonathan Flinchum | Liana Kreamer | Pega Davoudzadeh | Trevor Coppins | Rachel Callan,", Dropbox | , ExecLead | , Florida Institute of Technology | , Atlassian | , StackAdapt | , Adobe",/embedded/session/txIFuC91zxfXmk1Kefw1Z-3npWvIIX%40kh469Fy-hO5k%3D/5146193/?widget=primary
2026,761,Working Against the Clock: The Impact of Nonstandard Work Schedules (Session ID 761),"Friday, May 1",1:00 pm,1:50 pm,211/212/213,OCCUPATIONAL HEALTH/WORK AND FAMILY,Seoyeong Jeong | Chu-Hsiang (Daisy) Chang | Aarti Polavarapu | Laura Bauer | Hsiao-Feng Li,", Michigan State University | , Bowling Green State University | , National Yang Ming Chiao Tung University",/embedded/session/txIFuC91zxfXmk1Kefw1Z-3npWvIIX%40kh469Fy-hO5k%3D/5146194/?widget=primary
2026,340,Practical Methods for Driving Adoption of Talent and Analytics Programs (Session ID 340),"Friday, May 1",1:00 pm,1:50 pm,215/216,"MOTIVATION, ATTITUDES, AND EMOTIONS",Alice Pyclik | Evelina Ignasiak | Nicholas Carruth,", KeHE Distributors | , DePaul University | , UL Solutions",/embedded/session/txIFuC91zxfXmk1Kefw1Z-3npWvIIX%40kh469Fy-hO5k%3D/5146195/?widget=primary
