conference_year,display_session_id,title,date_label,start_time,end_time,location,tracks,speakers,speaker_affiliations,detail_href
2026,1449,SIOP Special Session: Well-Being Fatigue: When Employees Stop Believing the Company Cares (Session ID 1449),"Thursday, April 30",1:00 pm,1:50 pm,R7,OCCUPATIONAL HEALTH/WORK AND FAMILY | SPECIAL SESSION,P. Jewel Morrison | Hemang Vaidya | Ashlyn Kurtz | Alex Silverman,", New College of Florida | , The University of Akron | , Clemson University | , Center for Innovation Management & Business Analytics",/embedded/session/txIFuC91zxfXmk1Kefw1Z-3npWvIIX%40kh469Fy-hO5k%3D/5145892/?widget=primary
2026,700,Large Language Models as Methodological Partners in Organizational Research (Session ID 700),"Thursday, April 30",1:00 pm,1:50 pm,R8,TECHNOLOGY/ARTIFICIAL INTELLIGENCE,Hanyi Min | Hannah Walker | Andrew Speer | Joe Bradley | Levi Sassaman,", University of Illinois Urbana-Champaign | , Indiana University - Kelley School of Business | , UNCC",/embedded/session/txIFuC91zxfXmk1Kefw1Z-3npWvIIX%40kh469Fy-hO5k%3D/5145893/?widget=primary
2026,312,Is the Future of Strategic Workforce Planning Skills-Based? (Session ID 312),"Thursday, April 30",1:00 pm,1:50 pm,R9,ORGANIZATIONAL PROCESSES/DEVELOPMENT/CULTURE,Lauren Park | Angela Le Mathon | Aaron Sorensen | Cole Napper | Robert Motion,", SAP | , Walmart | , Lotis Blue Consulting | , HRBench | , RTX",/embedded/session/txIFuC91zxfXmk1Kefw1Z-3npWvIIX%40kh469Fy-hO5k%3D/5145894/?widget=primary
2026,,Partner Showcase: CodeSignal - Amplifying I-O with AI: Scaling Simulation Best Practices,"Thursday, April 30",1:00 pm,1:50 pm,224,SPONSORED,Seterra Riggs | Nathan Hundley,", CodeSignal",/embedded/session/txIFuC91zxfXmk1Kefw1Z-3npWvIIX%40kh469Fy-hO5k%3D/5256063/?widget=primary
2026,1131,From Silence to Backlash: The Costs of Diversity Resistance and How to Move Forward (Session ID 1131),"Thursday, April 30",2:00 pm,3:20 pm,202,"DIVERSITY, EQUITY, INCLUSION, AND ACCESSIBILITY",Johnathan Traylor | Lars Johnson | Jordan Johnson | Abigail Folberg | Deborah DiazGranados | Aaliyah Almeida,", George Washington University | , Clemson University | , University of Nebraska - Omaha | , Virginia Commonwealth University | , Claremont McKenna College",/embedded/session/txIFuC91zxfXmk1Kefw1Z-3npWvIIX%40kh469Fy-hO5k%3D/5145895/?widget=primary
2026,792,"Data Is the Beginning of Wisdom, Not the End: People Analytics Requires Soft Skills (Session ID 792)","Thursday, April 30",2:00 pm,3:20 pm,206,ORGANIZATIONAL PROCESSES/DEVELOPMENT/CULTURE,Sue Lam | Amy Stevenson | Jessica Thornton | Jordan Hartley | Kandice Almeida,", The Coca-Cola Company | , athenahealth | , Everpure | , Disney",/embedded/session/txIFuC91zxfXmk1Kefw1Z-3npWvIIX%40kh469Fy-hO5k%3D/5145896/?widget=primary
2026,826,Context Matters: Advancing Research on Healthcare Engagement and Burnout (Session ID 826),"Thursday, April 30",2:00 pm,3:20 pm,207,OCCUPATIONAL HEALTH/WORK AND FAMILY,Aisha Al-Amin | Alexander Jackson | Ava Morgan | Brent Reed | Cassidy Gaddie | Jürgen Bank | Lia Crowley,", San Diego State University | , Middle Tennessee State University (MTSU) | , Baruch College and The Graduate Center, CUNY | , University of North Carolina at Charlotte | , American Psychological Association | , FoundrsFuel | , Baruch College/The Graduate Center",/embedded/session/txIFuC91zxfXmk1Kefw1Z-3npWvIIX%40kh469Fy-hO5k%3D/5145898/?widget=primary
2026,,Riding the Waves of Age: Understanding the Complex Effects of Age at Work (Session ID1046),"Thursday, April 30",2:00 pm,3:20 pm,214,"MOTIVATION, ATTITUDES, AND EMOTIONS",Nicholas Lowery | Yiduo Shao | Donald Truxillo | Kaidi Wang | Miren Chenevert | Shona Smith,", University of Iowa | , Kemmy Business School, University of Limerick | , University of Florida | , University of Trento | , University of Houston",/embedded/session/txIFuC91zxfXmk1Kefw1Z-3npWvIIX%40kh469Fy-hO5k%3D/5145899/?widget=primary
2026,1337,I-O Psychology in Military Contexts: Reconnecting Fields to Tackle Emerging Challenges (Session ID 1337),"Thursday, April 30",2:00 pm,3:20 pm,217,GLOBAL/INTERNATIONAL/CROSS-CULTURAL ISSUES,Ann-Louise Holten | Ivana Igic | Eduardo Salas | Ingrid Covington | Kristin Saboe | Rylan Charlton | Steve Kozlowski,", Forsvarsakademiet · Full-time | , Military Academy ETH Zurich | , Rice University | , K U Leuven | , Google | , United States Air Force Academy | , University of South Florida",/embedded/session/txIFuC91zxfXmk1Kefw1Z-3npWvIIX%40kh469Fy-hO5k%3D/5145900/?widget=primary
2026,849,"Advancing the Science of Career Fit: Integrating Interests, Traits, and Job Contexts (Session ID 849)","Thursday, April 30",2:00 pm,3:20 pm,223,SELECTION/ASSESSMENT/INDIVIDUAL DIFFERENCES,Kevin Hoff | Alexis Hanna | Lena Roemer | Ethan Wright | Zihan Yan,", Michigan State University | , University of Nevada, Reno | , University of illinois",/embedded/session/txIFuC91zxfXmk1Kefw1Z-3npWvIIX%40kh469Fy-hO5k%3D/5145901/?widget=primary
2026,1451,"Community of Interest: Digital Boundaries and Cybervetting, Hiring, and Data Use (Session ID 1451)","Thursday, April 30",2:00 pm,2:50 pm,228,LEGAL/ETHICAL/CURRENT EVENTS/HUMANITARIAN/PRO-SOCIAL | SPECIAL SESSION | CONTENT AREA THEME TRACK,Deb Patrus Pena | Roza Jankovic | Katrisha Smith | Vicky Wang | Vivian Woo,", Research Assistant | , Culture Amp | , The Pennsylvania State University",/embedded/session/txIFuC91zxfXmk1Kefw1Z-3npWvIIX%40kh469Fy-hO5k%3D/5145902/?widget=primary
2026,140,DEI Backfire Effects: Cause for Concern or Much Ado About Nothing? (Session ID 140),"Thursday, April 30",2:00 pm,3:20 pm,203/204,"DIVERSITY, EQUITY, INCLUSION, AND ACCESSIBILITY",Alondrea Hubbard | Jorge Lumbreras | David Arena | Hannah Park | Elisabeth Silver,", Rutgers University | , California State University, Sacramento | , University of Texas at Arlington | , Michigan State University",/embedded/session/txIFuC91zxfXmk1Kefw1Z-3npWvIIX%40kh469Fy-hO5k%3D/5145903/?widget=primary
2026,804,Binge-Worthy Leadership Development: Enhancing Learning Through Popular TV Series (Session Id 804),"Thursday, April 30",2:00 pm,3:20 pm,208/209/210,LEADERSHIP/LEADER DEVELOPMENT,Adam Smith | Janis Ward | Laura Heaton | Miriam Nelson | Ronald Festa | Seymour Adler | Sayeedul Islam,", Harvard University | , J. M. Ward Consulting | , Penske Transportation Solutions | , Korn Ferry | , New Heights Consulting | , Spencer Stuart | , Talent Metrics",/embedded/session/txIFuC91zxfXmk1Kefw1Z-3npWvIIX%40kh469Fy-hO5k%3D/5145904/?widget=primary
2026,412,"Psychological Mechanisms in Entrepreneurship: Self-Efficacy, Work Design, and Well-Being (Session ID 412)","Thursday, April 30",2:00 pm,3:20 pm,211/212/213,OCCUPATIONAL HEALTH/WORK AND FAMILY,Jun-Yeob Kim | Sang-Hoon Lee | Alexander Glosenberg | Shanon Yang | Gavin Williamson,", University of Central Florida | , Loyola Marymount University | , Syracuse University | , Rowan University",/embedded/session/txIFuC91zxfXmk1Kefw1Z-3npWvIIX%40kh469Fy-hO5k%3D/5145905/?widget=primary
2026,62,From Tools to Teammates: Applying Team Science to Advance Human–AI Collaboration (Session ID 62),"Thursday, April 30",2:00 pm,3:20 pm,215/216,GROUPS/TEAMS,Alexandra Harris-Watson | Changyoon Byun | Brandon Kang | Maxwell Brunell | Jeffrey Masser | Momo Akib | Stephanie (Stevie) Boettcher,", Purdue University | , University of Georgia | , University of South Florida | , Florida Institute of Technology",/embedded/session/txIFuC91zxfXmk1Kefw1Z-3npWvIIX%40kh469Fy-hO5k%3D/5145906/?widget=primary
2026,1246,From Ideology to Action: Cultivating Allyship and Inclusion in Diverse Workplaces (Session ID 1246),"Thursday, April 30",2:00 pm,3:20 pm,218/219,"DIVERSITY, EQUITY, INCLUSION, AND ACCESSIBILITY | CONTENT AREA THEME TRACK",Anthony Roberson | Kisha Jones | Joshua Ash | Lawrence Houston | Toschia M Hogan | Johanna Desormont,", AFR Solutions | , Florida International University - College of Business | , University of Houston | , SIOP | , Saint Louis University | , Florida International University",/embedded/session/txIFuC91zxfXmk1Kefw1Z-3npWvIIX%40kh469Fy-hO5k%3D/5145907/?widget=primary
2026,1137,Good Enough to Be Good: Talent Decisions Under Speed and Scrutiny (Session ID 1137),"Thursday, April 30",2:00 pm,3:20 pm,220/221/222,ORGANIZATIONAL PROCESSES/DEVELOPMENT/CULTURE | CONTENT AREA THEME TRACK,Eileen Linnabery | Ginevra Drinka | Max Alexander | Meghan Moriarty Gerrard | Sam Paruchuri | Lauren Zervos,", Vantage Leadership Consulting | , Victoria’s Secret & Company | , Golub Capital | , US Foods | , AbbVie | , CIBC",/embedded/session/txIFuC91zxfXmk1Kefw1Z-3npWvIIX%40kh469Fy-hO5k%3D/5145908/?widget=primary
2026,134,Gen AI and the Future of Assessment: From Mitigating Cheating to Embracing Innovation (Session ID 134),"Thursday, April 30",2:00 pm,3:20 pm,225/226,SELECTION/ASSESSMENT/INDIVIDUAL DIFFERENCES,Hennie Kriek | Jouko van Aggelen | Nathan Mondragon | Rab MacIver | Ryne Sherman | Ted Kinney,", TTS-Top Talent Solutions Inc. | , Aon | , ProboTalent | , Saville Assessment Ltd | , Hogan Assessments | , Talogy",/embedded/session/txIFuC91zxfXmk1Kefw1Z-3npWvIIX%40kh469Fy-hO5k%3D/5145909/?widget=primary
2026,437,Beyond Kirkpatrick: New Models and Real-World Strategies for Training Evaluation (Session ID 437),"Thursday, April 30",2:00 pm,3:20 pm,B2-1,TRAINING/COACHING/MENTORING | CONTENT AREA THEME TRACK,Amy DuVernet | Alyssa Kaszycki | Danielle Suprick | Dr. Eric Surface,", Training Industry, Inc. | , Golden Aluminum | , ALPS Insights",/embedded/session/txIFuC91zxfXmk1Kefw1Z-3npWvIIX%40kh469Fy-hO5k%3D/5145910/?widget=primary
2026,554,Advancing Human–AI Collaboration in High-Stakes and Safety-Critical Work (Session ID 554),"Thursday, April 30",2:00 pm,3:20 pm,B2-2,TECHNOLOGY/ARTIFICIAL INTELLIGENCE | CONTENT AREA THEME TRACK,Marissa Shuffler | Sadie Hogge | Allen Brown | Jeffrey Olenick | Sydney Begerowski,", Clemson University | , Georgia Tech | , Carnegie Mellon University | , The University of Georgia | , NASA (KBR)",/embedded/session/txIFuC91zxfXmk1Kefw1Z-3npWvIIX%40kh469Fy-hO5k%3D/5145911/?widget=primary
2026,,Research Methods/Measurement/Statistics Posters,"Thursday, April 30",2:00 pm,2:50 pm,Exhibit Hall,POSTER | RESEARCH METHODS/MEASUREMENT/STATISTICS,,,
2026,339,GenAI and the Death (Or Rebirth) of Management (Session ID 339),"Thursday, April 30",2:00 pm,3:20 pm,R1,TECHNOLOGY/ARTIFICIAL INTELLIGENCE,Autumn Krauss | Alexis Fink | Chantale (Wilson) Antonik | Evan Sinar | Shonna Waters,", SAP SuccessFactors | , Propeller Insight, LLC | , Amazon | , Fractional Insights",/embedded/session/txIFuC91zxfXmk1Kefw1Z-3npWvIIX%40kh469Fy-hO5k%3D/5145936/?widget=primary
2026,975,"Academic Demands, Evaluation Standards, and Scientist–Practitioner Engagement (Session ID 975)","Thursday, April 30",2:00 pm,3:20 pm,R2,I-O PSYCHOLOGIST CAREER DEVELOPMENT/TEACHING,Faith Shannon | Lucia Hardin | Matthew Ng | Mike Chetta | Russell Matthews | Steve Jex,", Auburn University | , Missouri University of Science and Technology | , Talent Metrics | , University of Alabama | , University of Central Florida",/embedded/session/txIFuC91zxfXmk1Kefw1Z-3npWvIIX%40kh469Fy-hO5k%3D/5145937/?widget=primary
2026,328,Navigating Headwinds to AI in Assessment (Session ID 328),"Thursday, April 30",2:00 pm,3:20 pm,R4,TECHNOLOGY/ARTIFICIAL INTELLIGENCE,John Weiner | Charles Handler | Eric Dunleavy | Marc Weinstein,", ACT | , Rocket-Hire | , DCI Consulting Group, Inc. | , Marc J. Weinstein PLLC",/embedded/session/txIFuC91zxfXmk1Kefw1Z-3npWvIIX%40kh469Fy-hO5k%3D/5145938/?widget=primary
2026,489,"“Are You Psychoanalyzing Me?"": An Elevator Pitch Competition to Rebrand I-O Psychology (Session ID 489)","Thursday, April 30",2:00 pm,3:20 pm,R5,I-O PSYCHOLOGIST CAREER DEVELOPMENT/TEACHING,Alex Ochoa | Zytlaly Magaña,", Gothic Landscape | , Latinos in I-O Psychology",/embedded/session/txIFuC91zxfXmk1Kefw1Z-3npWvIIX%40kh469Fy-hO5k%3D/5145939/?widget=primary
2026,722,Designing and Conducting Constructive Replication Studies (Session ID 722),"Thursday, April 30",2:00 pm,3:20 pm,R6,RESEARCH METHODS/MEASUREMENT/STATISTICS,Maria Kraimer | scott Seibert | William Obenauer,", University at Buffalo | , University of Maine",/embedded/session/txIFuC91zxfXmk1Kefw1Z-3npWvIIX%40kh469Fy-hO5k%3D/5145940/?widget=primary
2026,,"Prompt, Don’t Panic: GenAI for Essential I-O Workflows (Session ID1059)","Thursday, April 30",2:00 pm,3:20 pm,R7,TECHNOLOGY/ARTIFICIAL INTELLIGENCE,David Mayers | Krystina Moustakis,", Knockri | , Uber",/embedded/session/txIFuC91zxfXmk1Kefw1Z-3npWvIIX%40kh469Fy-hO5k%3D/5145941/?widget=primary
2026,201,Designing and Building AI Agents for High-Stakes I-O Applications: A Master Tutorial (Session ID 201),"Thursday, April 30",2:00 pm,3:20 pm,R8,TECHNOLOGY/ARTIFICIAL INTELLIGENCE,Andrew Samo | Cameron Beazley | James Meaden | Karim Badr,", RHR International | , SHL | , Founder @ The Alive Institute",/embedded/session/txIFuC91zxfXmk1Kefw1Z-3npWvIIX%40kh469Fy-hO5k%3D/5145942/?widget=primary
2026,585,The Rise of AI in the Training Ecosystem: Insights From Applied Research (Session ID 585),"Thursday, April 30",2:00 pm,3:20 pm,R9,TECHNOLOGY/ARTIFICIAL INTELLIGENCE,Alexxa Bessey | Deri Draper-Amason | Robert McCormack | Adrian Flowers | Isabel Erikson,", Aptima | , Old Dominion University, Center for Mission Engineering · Full-time | , Aptima, Inc.",/embedded/session/txIFuC91zxfXmk1Kefw1Z-3npWvIIX%40kh469Fy-hO5k%3D/5145944/?widget=primary
2026,1165,Is ROI Dead? Debating the Value of Its Impact in Outcome Measurement (Session ID 1165),"Thursday, April 30",2:00 pm,3:20 pm,R3,RESEARCH METHODS/MEASUREMENT/STATISTICS,Andrew Thurston | Bryn Chighizola | Kalifa Oliver | Mounica Reddy | Wayne Cascio | Lora Bishop | Alyssa Green,", U.S. Department of Defense | , Korn Ferry | , Lowe’s Home Improvement | , PepsiCo | , Lotis Blue Consulting",/embedded/session/txIFuC91zxfXmk1Kefw1Z-3npWvIIX%40kh469Fy-hO5k%3D/5145716/?widget=primary
2026,,Partner Showcase: Valence - From Chatbot to Coach: Designing Systems That Actually Develop People,"Thursday, April 30",2:00 pm,3:20 pm,224,SPONSORED,Elizabeth Ritterbush | Beth Shipman | Julia Walsh | Ellie Wildman | Rob Lewis,", The Home Depot | , Corning Incorporated | , General Mills | , Valence | , ADP",/embedded/session/txIFuC91zxfXmk1Kefw1Z-3npWvIIX%40kh469Fy-hO5k%3D/5256081/?widget=primary
2026,,Coffee Break with the Exhibitors,"Thursday, April 30",3:30 pm,4:00 pm,,"BREAKFAST, LUNCH & BREAKS",,,
2026,851,Expanding the Lens: I-O Practice for Overlooked Workers (Session ID 851),"Thursday, April 30",4:00 pm,4:50 pm,202,"DIVERSITY, EQUITY, INCLUSION, AND ACCESSIBILITY",Hannah Yung-Boxdell | Lauren Kiproff-Downer | Peter Reiley | Stephanie Turner | Victoria Frerichs,", The Alignment Lab, LLC (alignmentlab.online) | , Perpara Organizational Development Consulting | , Leadership Arts & Sciences | , Tuck School of Business, Dartmouth College | , Fairlead",/embedded/session/txIFuC91zxfXmk1Kefw1Z-3npWvIIX%40kh469Fy-hO5k%3D/5145945/?widget=primary
2026,119,Personality and Leadership Emergence in Undergraduate Student Leaders (Session ID 119),"Thursday, April 30",4:00 pm,4:50 pm,206,LEADERSHIP/LEADER DEVELOPMENT,Chase Winterberg | Daniel King | Anne Greenhalgh,", Hogan Assessments | , Talent Strategies Consulting | , The Wharton School, University of Pennsylvania",/embedded/session/txIFuC91zxfXmk1Kefw1Z-3npWvIIX%40kh469Fy-hO5k%3D/5145946/?widget=primary
2026,1280,How to Leverage Employee Listening Data to Effectively Drive Change (Session ID 1280),"Thursday, April 30",4:00 pm,4:50 pm,207,ORGANIZATIONAL PROCESSES/DEVELOPMENT/CULTURE,Erica Pachmann | Linden Wooderson | Rhonda Buseman,", Culture Amp | , The Guitar Center Company | , Benchmark Electronics · Full-time",/embedded/session/txIFuC91zxfXmk1Kefw1Z-3npWvIIX%40kh469Fy-hO5k%3D/5145947/?widget=primary
2026,227,Stick the Landing: Reducing Early Risk of New Leader Failure (Session ID 227),"Thursday, April 30",4:00 pm,4:50 pm,214,LEADERSHIP/LEADER DEVELOPMENT,Jessie McClure | Lauren Wallace | Mina Morris | Robin Cohen,", Hogan Assessments | , Google | , Accenture | , Robin Cohen Leadership",/embedded/session/txIFuC91zxfXmk1Kefw1Z-3npWvIIX%40kh469Fy-hO5k%3D/5145948/?widget=primary
2026,442,Beyond Design: When I-O Psychologists Cross the Assessment Divide (Session ID 442),"Thursday, April 30",4:00 pm,4:50 pm,217,SELECTION/ASSESSMENT/INDIVIDUAL DIFFERENCES,Mike Wojcik | Kelsey Byerly | Menucha Sperlin | Nick Walion | Pamela Baumer | Robert Minjock,", Human Resources Research Organization | , PDRI by Pearson | , Port Authority of New York New Jersey | , HumRRO | , Fairfax County Government",/embedded/session/txIFuC91zxfXmk1Kefw1Z-3npWvIIX%40kh469Fy-hO5k%3D/5145949/?widget=primary
2026,452,Ways to Address Flawed Assumptions in Testing (Session ID 452),"Thursday, April 30",4:00 pm,4:50 pm,223,SELECTION/ASSESSMENT/INDIVIDUAL DIFFERENCES,Dr. Joel P. Wiesen,", Applied Personnel Research",/embedded/session/txIFuC91zxfXmk1Kefw1Z-3npWvIIX%40kh469Fy-hO5k%3D/5145950/?widget=primary
2026,726,Organization Development: Lessons From the Field on What Really Works (Session ID 726),"Thursday, April 30",4:00 pm,4:50 pm,203/204,ORGANIZATIONAL PROCESSES/DEVELOPMENT/CULTURE,Steve Garguilo | Brandon Smith | Randall Lucius | Stephen Young,", Cultivate | , Penske Transportation Solutions | , Emory University | , Caterpillar Inc.",/embedded/session/txIFuC91zxfXmk1Kefw1Z-3npWvIIX%40kh469Fy-hO5k%3D/5145951/?widget=primary
2026,1300,"The Dark Side of Meaningful Work: Passion, Burnout, and Organizational Responsibility (Session ID 1300)","Thursday, April 30",4:00 pm,4:50 pm,208/209/210,OCCUPATIONAL HEALTH/WORK AND FAMILY,Malissa Clark | Javon Davis | Shelby Davis,", University of Georgia | , Colorado State University",/embedded/session/txIFuC91zxfXmk1Kefw1Z-3npWvIIX%40kh469Fy-hO5k%3D/5145952/?widget=primary
2026,157,Eight Mistakes We Make With High-Potential Programs (Session ID 157),"Thursday, April 30",4:00 pm,4:50 pm,211/212/213,LEADERSHIP/LEADER DEVELOPMENT,Kimberly Silva | Alanna Harrington | Allison Tringale | Charmane Harrison | Kayla Schulman,", Talogy | , A.Y. McDonald Industries | , Federal Reserve Bank of Cleveland | , Kayla Schulman Strategies LLC",/embedded/session/txIFuC91zxfXmk1Kefw1Z-3npWvIIX%40kh469Fy-hO5k%3D/5145953/?widget=primary
2026,182,High-Potential Leader Characteristics and Strategies for Communicating Hi-Po Status (Session ID 182),"Thursday, April 30",4:00 pm,4:50 pm,215/216,LEADERSHIP/LEADER DEVELOPMENT,"Keith McCook, Ph.D. | Adam Kabins | Lauren Wegmeyer | Martin Lanik | Shloka Goyal",", Heidrick & Struggles | , McLane | , PepsiCo | , Pinsight | , Aon",/embedded/session/txIFuC91zxfXmk1Kefw1Z-3npWvIIX%40kh469Fy-hO5k%3D/5145954/?widget=primary
2026,314,Workplace Wisdom: Three Micro-Interventions to Transform Connection at Work (Session ID 314),"Thursday, April 30",4:00 pm,4:50 pm,218/219,ORGANIZATIONAL PROCESSES/DEVELOPMENT/CULTURE | CONTENT AREA THEME TRACK,"Helen Chung | Kristine Reeves | Mariko Harman | William Thai, PhD",", Seattle Pacific University | , Washington State House of Representatives | , Scontrino-Powell | , Walmart",/embedded/session/txIFuC91zxfXmk1Kefw1Z-3npWvIIX%40kh469Fy-hO5k%3D/5145955/?widget=primary
2026,877,Beyond Correlation: A Practical Guide to Causal Analytics for I-O Psychologists (Session ID 877),"Thursday, April 30",4:00 pm,4:50 pm,220/221/222,I-O PSYCHOLOGIST CAREER DEVELOPMENT/TEACHING | CONTENT AREA THEME TRACK,Nathan Hundley | Seterra Riggs,", CodeSignal",/embedded/session/txIFuC91zxfXmk1Kefw1Z-3npWvIIX%40kh469Fy-hO5k%3D/5145956/?widget=primary
2026,854,"In the Trenches Part 5: Maintaining SJTs in High-Stakes, High-Volume Testing Programs (Session ID 854)","Thursday, April 30",4:00 pm,4:50 pm,225/226,SELECTION/ASSESSMENT/INDIVIDUAL DIFFERENCES,Beth Bynum | Filip Lievens | Genevieve Ainslie | Marc Kroopnick | Susan D'Mello,", HumRRO | , Singapore Management University | , Association of American Medical Colleges | , Google",/embedded/session/txIFuC91zxfXmk1Kefw1Z-3npWvIIX%40kh469Fy-hO5k%3D/5145957/?widget=primary
2026,945,The C-Suite Partnership That Drives Performance: A CEO and CHRO in Conversation (Session ID 945),"Thursday, April 30",4:00 pm,4:50 pm,B2-1,LEADERSHIP/LEADER DEVELOPMENT | CONTENT AREA THEME TRACK,Kathy Schnure,", Spencer Stuart",/embedded/session/txIFuC91zxfXmk1Kefw1Z-3npWvIIX%40kh469Fy-hO5k%3D/5145958/?widget=primary
2026,,"Technology/Artificial Intelligence; Training/Coaching/Mentoring; Diversity, Equity, Inclusion, and Accessibility; Organizational Processes/Development/Culture Posters","Thursday, April 30",4:00 pm,4:50 pm,Exhibit Hall,"POSTER | TECHNOLOGY/ARTIFICIAL INTELLIGENCE | TRAINING/COACHING/MENTORING | ORGANIZATIONAL PROCESSES/DEVELOPMENT/CULTURE | DIVERSITY, EQUITY, INCLUSION, AND ACCESSIBILITY",,,
2026,682,"Insufficient Effort Responding in Survey Research: Impact, Mitigation, and Management (Session ID 682)","Thursday, April 30",4:00 pm,4:50 pm,R1,RESEARCH METHODS/MEASUREMENT/STATISTICS,Gary Burns | Montana Drake | Krista Harris | Mark Roebke | Michael W. McFerran,", Florida Institute of Technology | , DCS Corporation | , DCS Corp | , Air Force Institute of Technology | , Wells Fargo",/embedded/session/txIFuC91zxfXmk1Kefw1Z-3npWvIIX%40kh469Fy-hO5k%3D/5146000/?widget=primary
2026,435,From Graduate School to Practice: Navigating the Early Years as an I-O Professional (Session ID 435),"Thursday, April 30",4:00 pm,4:50 pm,R2,I-O PSYCHOLOGIST CAREER DEVELOPMENT/TEACHING,Alexis Rivkin | Ally LeVine | Brianna Camacho | Savana Holmes | Luke Kayga | Samantha Brooks,", Value Management Strategies, Inc. | , Thermo Fisher Scientific | , City of Los Angeles | , SKS Consulting Group | , Culture Amp | , Deloitte",/embedded/session/txIFuC91zxfXmk1Kefw1Z-3npWvIIX%40kh469Fy-hO5k%3D/5146001/?widget=primary
2026,1467,SIOP Executive Board: Navigating the Federal Landscape: Government Relations and Scientific Advocacy for I- (Session ID 1467),"Thursday, April 30",4:00 pm,4:50 pm,R3,LEGAL/ETHICAL/CURRENT EVENTS/HUMANITARIAN/PRO-SOCIAL | SPECIAL SESSION,Alexis Fink | Allison Reed | David Feldner | Kristin Saboe | Mia Luckett | Richard Landers | Scott Tannenbaum,", Propeller Insight, LLC | , Lewis-Burke Associates | , SIOP | , Google | , Lewis-Burke Associates LLC | , Society for Industrial and Organizational Psychology (APA Div #14) | , The Group for Organizational Effectiveness, Inc",/embedded/session/txIFuC91zxfXmk1Kefw1Z-3npWvIIX%40kh469Fy-hO5k%3D/5146002/?widget=primary
2026,964,Automated Anonymous: Education and Reskilling for I-Os in the Age of Automation (Session ID 964),"Thursday, April 30",4:00 pm,4:50 pm,R4,TECHNOLOGY/ARTIFICIAL INTELLIGENCE,Steven Toaddy | Shawn Bergman | Eric Kuo,", Appalachian State University | , Uplevel",/embedded/session/txIFuC91zxfXmk1Kefw1Z-3npWvIIX%40kh469Fy-hO5k%3D/5146003/?widget=primary
2026,570,Building the Plane as We Fly It: Utilizing Interns to Pilot New Programs (Session ID 570),"Thursday, April 30",4:00 pm,4:50 pm,R5,I-O PSYCHOLOGIST CAREER DEVELOPMENT/TEACHING,Thisali Mendis | Anne Winkhart | Eric Marko | Jonas Sutphin | Kaitlin Busse | Mindy Wu | Cindy Dziuba-Liu,", George Mason University | , The University of Akron | , Spellman High Voltage Electronics Corporation | , BTS | , Google | , Navy Federal Credit Union",/embedded/session/txIFuC91zxfXmk1Kefw1Z-3npWvIIX%40kh469Fy-hO5k%3D/5146004/?widget=primary
2026,1042,Assessing the State of the Field: A Reflexive Community Conversation (Session ID 1042),"Thursday, April 30",4:00 pm,4:50 pm,R6,LEGAL/ETHICAL/CURRENT EVENTS/HUMANITARIAN/PRO-SOCIAL,Carly Bruck | David Reeves | Patrick Hyland,", Mercer | Sirota | , Remesh",/embedded/session/txIFuC91zxfXmk1Kefw1Z-3npWvIIX%40kh469Fy-hO5k%3D/5146005/?widget=primary
2026,1464,Award: SIOP Distinguished Professional Practice Award Winners: Dr. Shepherd and Dr. Vandaveer (Session Id 1464),"Thursday, April 30",4:00 pm,4:50 pm,R7,I-O PSYCHOLOGIST CAREER DEVELOPMENT/TEACHING | SPECIAL SESSION | AWARD WINNER,Vicki Vandaveer | Dr. William Shepherd,", Vandaveer Group, Inc | , Elevation Leadership, LLC",/embedded/session/txIFuC91zxfXmk1Kefw1Z-3npWvIIX%40kh469Fy-hO5k%3D/5146006/?widget=primary
2026,1441,SIOP Executive Board: Ethical AI in I-O Practice: From Member Insights to Practical Considerations (Session ID 1441),"Thursday, April 30",4:00 pm,4:50 pm,R8,TECHNOLOGY/ARTIFICIAL INTELLIGENCE | SPECIAL SESSION,Joanie Connell | John Weiner | Kasey Guentert | Logan Watts,", Flexible Work Solutions | , ACT | , APT Metrics | , University of Texas at Arlington",/embedded/session/txIFuC91zxfXmk1Kefw1Z-3npWvIIX%40kh469Fy-hO5k%3D/5146007/?widget=primary
2026,1281,"Humanizing AI in the Candidate Journey: Building Trust, Fairness, and Personalization (Session ID 1281)","Thursday, April 30",4:00 pm,4:50 pm,R9,TECHNOLOGY/ARTIFICIAL INTELLIGENCE,Brittany Dian | Heather Mooney | Marc Cubrich | Trevor McGlochlin | Zachary Warman,", DCI Consulting Group, Inc. | , APTMetrics | , PepsiCo | , Talogy | , Perceptyx",/embedded/session/txIFuC91zxfXmk1Kefw1Z-3npWvIIX%40kh469Fy-hO5k%3D/5146008/?widget=primary
2026,425,Huddling Up to Level Up: Advancing I-O Psychology Through Sport (and Vice Versa) (Session ID 425),"Thursday, April 30",4:00 pm,4:50 pm,229,RESEARCH METHODS/MEASUREMENT/STATISTICS,Marlee Moore | Brent Oja | Matt Huml | Don Zhang,", Clemson University | , Louisiana State University | , University of Cincinnati · Full-time",/embedded/session/txIFuC91zxfXmk1Kefw1Z-3npWvIIX%40kh469Fy-hO5k%3D/5146511/?widget=primary
2026,1448,Community of Interest: Making Invisible Labor Visible: Hidden Work and Org. Success (Session ID 1448),"Thursday, April 30",4:00 pm,4:50 pm,228,"MOTIVATION, ATTITUDES, AND EMOTIONS | SPECIAL SESSION",Deb Patrus Pena | Emily Gallegos | Kortney Kosak-Koberna,", Research Assistant | , University of Texas at Arlington",/embedded/session/txIFuC91zxfXmk1Kefw1Z-3npWvIIX%40kh469Fy-hO5k%3D/5146704/?widget=primary
